product_id;price;product;brand;unit_price;units;categories;discount;date
177732;3.05;BONTE aceite seco para piel y cabello botella 150 ml;BONTE;20.33;€/l.;['Cuidado personal', 'Cuidado corporal', 'Hidratación corporal'];;2023-01-06
274995;5.19;SPONTEX guantes protección antivirus talla 7 caja 30 + 6 uds;SPONTEX;0.14;€/ud.;['Cuidado del hogar', 'Utensilios de limpieza'];;2023-01-06
110097;0.57;DIA BOBBY BITTER bitter lata 25 cl;DIA BOBBY BITTER;2.28;€/l.;['Bebidas', 'Refrescos'];;2023-01-06
100604;2.85;DIA LACTEA yogur sabores pack 16 unidades 125 gr;DIA LACTEA;1.43;€/Kg.;['Despensa', 'Lácteos y huevos', 'Yogures'];;2023-01-06
266806;2.79;DIA AL PUNTO gyozas de pollo y verduras al teppanyaki bandeja 8 uds 150 gr;DIA AL PUNTO;19.93;€/Kg.;['Platos preparados', 'Croquetas y aperitivos'];;2023-01-06
14246;2.59;SAN suavizante concentrado esencia para recordar botella 59 lv;SAN;2.59;€/ud.;['Cuidado del hogar', 'Cuidado de la ropa'];;2023-01-06
274541;2.55;LA RECETA huevos ecológicos categoría A clase M/L estuche 6 uds;LA RECETA;0.42;€/ud.;['Despensa', 'Lácteos y huevos', 'Huevos'];;2023-01-06
1413;1.55;DIA AL PUNTO mini empanadillas de atún bolsa 400 gr;DIA AL PUNTO;3.88;€/Kg.;['Congelados', 'Precocinados'];;2023-01-06
277772;1.05;DIA ZUMOSFERA zumo de piña y uva 100% pack 3 unidades 200 ml;DIA ZUMOSFERA;1.75;€/l.;['Bebidas', 'Zumos'];;2023-01-06
33365;1.89;DIA PATATAS UNIDAS puré de patatas caja 500 gr;DIA PATATAS UNIDAS;3.78;€/Kg.;['Despensa', 'Sopas', 'Cremas y purés'];;2023-01-06
225301;7.99;FINISH lavavajillas máquina todo en uno limón bote 35 lv;FINISH;11.41;€/l.;['Cuidado del hogar', 'Lavavajillas'];;2023-01-06
120827;4.35;DIA CAFETERÍA café en grano natural paquete 500 gr;DIA CAFETERÍA;8.7;€/Kg.;['Despensa', 'Desayunos y dulces', 'Café'];;2023-01-06
1721;1.59;NESTLE chocolate con almendras tableta 123 gr;NESTLE;12.93;€/Kg.;['Despensa', 'Desayunos y dulces', 'Chocolates y bombones'];;2023-01-06
273491;3.29;DIA TEMPTATION surtido bombones sin azúcar caja 200 gr;DIA TEMPTATION;16.45;€/Kg.;['Despensa', 'Desayunos y dulces', 'Chocolates y bombones'];;2023-01-06
184027;14.47;PORTIA CRIANZA vino tinto botella 75 cl;PORTIA CRIANZA;19.29;€/l.;['Bodega', 'Vino', 'Tinto'];;2023-01-06
273522;1.89;SELECCIÓN DE DIA morcilla de cebolla bandeja 300 gr;SELECCIÓN DE DIA;6.3;€/Kg.;['Frescos', 'Carne', 'Cerdo'];;2023-01-06
134070;2.3;Ajetes tiernos manojo 200 gr;;2.3;€/ud.;['Frescos', 'Verduras y hortalizas', 'Ajos. cebollas y puerros'];;2023-01-06
166223;2.39;SELECCIÓN DE DIA filete de cinta de lomo marinado bandeja 300 gr;SELECCIÓN DE DIA;7.97;€/Kg.;['Frescos', 'Carne', 'Cerdo'];;2023-01-06
116;0.5;Pimiento italiano unidad (200 gr aprox.);;2.49;€/Kg.;['Frescos', 'Verduras y hortalizas', 'Tomates. pimientos y pepinos'];;2023-01-06
246216;2.15;HERO Diet mermelada de ciruela frasco 280 gr;HERO;7.68;€/Kg.;['Despensa', 'Desayunos y dulces', 'Mermeladas. miel y frutas en almíbar'];;2023-01-06
241317;8.99;ARIEL detergente máquina líquido básico botella 31 lv;ARIEL;0.29;€/Lavado;['Cuidado del hogar', 'Cuidado de la ropa'];;2023-01-06
264828;0.89;SCHWEPPES citrus lata 33 cl;SCHWEPPES;2.7;€/l.;['Bebidas', 'Refrescos'];;2023-01-06
230656;1.09;NESTLE Naturnes multifrutas pouch 90 gr;NESTLE;12.11;€/Kg.;['Bebé', 'Potitos y tarritos'];;2023-01-06
280249;1.59;HUESITOS chocolate con leche tableta 125 gr;HUESITOS;12.72;€/Kg.;['Despensa', 'Desayunos y dulces', 'Chocolates y bombones'];;2023-01-06
10065P4;3.96;DIA HOLA COLA refresco de cola botella 2 lt PACK 4;DIA HOLA COLA;0.5;€/l.;['Bebidas', 'Refrescos'];;2023-01-06
218126;10.05;SAN MARTIN tarta bombón envase 1 Kg;SAN MARTIN;10.05;€/Kg.;['Congelados', 'Repostería'];;2023-01-06
285849;14.19;FIREBALL whisky botella 70 cl;FIREBALL;20.27;€/l.;['Bodega', 'Alcoholes', 'Whisky'];;2023-01-06
194774;2.99;HS champú anticaspa suave y sedoso bote 230 ml;HS;13.0;€/l.;['Cuidado personal', 'Baño e higiene personal', 'Champús'];;2023-01-06
50567;0.27;DIA agua mineral natural botella 33 cl;DIA;0.82;€/l.;['Bebidas', 'Aguas'];;2023-01-06
206497;4.99;ORIGINAL REMEDIES mascarilla oliva mítica tarro 300 ml;ORIGINAL REMEDIES;16.63;€/l.;['Cuidado personal', 'Baño e higiene personal', 'Cuidado del cabello'];;2023-01-06
178088;1.25;BONTE compresas de gasa esterilizadas 7.5 x 7.5 cm caja 5 x 2 uds;BONTE;0.13;€/ud.;['Cuidado personal', 'Botiquín'];;2023-01-06
124801;1.49;SELECCIÓN DE DIA morcilla de Burgos pieza 300 gr;SELECCIÓN DE DIA;4.97;€/Kg.;['Frescos', 'Carne', 'Cerdo'];;2023-01-06
108508;1.05;DIA bayeta absorbente y suave paquete 6 uds;DIA;0.18;€/ud.;['Cuidado del hogar', 'Utensilios de limpieza'];;2023-01-06
284277;6.99;ARIEL Pods detergente máquina all in 1 fresh sensations en cápsulas 12 lv;ARIEL;0.58;€/Lavado;['Cuidado del hogar', 'Cuidado de la ropa'];;2023-01-06
196693;2.79;GRANINI néctar de arándanos y uva botella 1 lt;GRANINI;2.79;€/l.;['Bebidas', 'Zumos'];;2023-01-06
43932;2.99;GLASSEX limpiador multiusos pistola 750 ml;GLASSEX;3.99;€/l.;['Cuidado del hogar', 'Productos de limpieza', 'Hogar'];;2023-01-06
78698;2.1;HELIOS mermelada extra fresa frasco 340 grs;HELIOS;6.18;€/Kg.;['Despensa', 'Desayunos y dulces', 'Mermeladas. miel y frutas en almíbar'];;2023-01-06
187906;4.19;CARMENCITA popurrí de pimientas frasco 40 gr;CARMENCITA;104.75;€/Kg.;['Despensa', 'Sal y especias'];;2023-01-06
273737;1.99;DIA NUESTRA ALACENA jamón cocido 97% carne envase 150 gr;DIA NUESTRA ALACENA;13.27;€/Kg.;['Frescos', 'Charcutería y quesos', 'Cocidos'];;2023-01-06
283796;6.29;PANTENE champú suave y liso pack 2 uds 250 ml;PANTENE;12.58;€/l.;['Cuidado personal', 'Baño e higiene personal', 'Champús'];;2023-01-06
130058;3.99;VITROCLEN limpiador vitrocerámica crema botella 200 ml;VITROCLEN;19.95;€/l.;['Cuidado del hogar', 'Productos de limpieza', 'Cocina'];;2023-01-06
291287;5.99;COLON detergente máquina líquido básico botella 40 lv;COLON;0.15;€/Lavado;['Cuidado del hogar', 'Cuidado de la ropa'];;2023-01-06
265653;4.05;HIMALAYA espuma limpiadora facial de Nim dosificador 150 ml;HIMALAYA;27.0;€/l.;['Cuidado personal', 'Cuidado corporal', 'Limpieza facial'];;2023-01-06
289591;2.49;MINERVA sardinas en escabeche lata 85 gr;MINERVA;29.29;€/Kg.;['Despensa', 'Conservas', 'Conservas de pescado'];;2023-01-06
203958;2.05;DIA bases de pizza finas bolsa 3 x 140 gr;DIA;4.88;€/Kg.;['Congelados', 'Pizzas. bases y masas'];;2023-01-06
205092;4.34;TAMPAX Compak Pearl super tampón caja 16 uds;TAMPAX;0.27;€/ud.;['Cuidado personal', 'Cuidado íntimo'];;2023-01-06
176684;1.75;BONTE pasta dentífrica formato viaje pack 3 x 25 ml;BONTE;23.33;€/l.;['Cuidado personal', 'Cuidado bucal'];;2023-01-06
235853;4.09;L'OR café fortissimo caja 10 cápsulas;L;0.41;€/ud.;['Despensa', 'Desayunos y dulces', 'Café'];;2023-01-06
165035;1.59;DANONE copa chocolate 2 unidades x 110 gr;DANONE;7.23;€/Kg.;['Despensa', 'Lácteos y huevos', 'Postres'];;2023-01-06
163742;3.99;HEINZ ketchup light botella 550 gr;HEINZ;7.25;€/Kg.;['Despensa', 'Salsas', 'Mayonesa y otras salsas'];;2023-01-06
137502;1.19;COSTA sal plus+ paquete 1 Kg;COSTA;1.19;€/Kg.;['Despensa', 'Sal y especias'];;2023-01-06
290660;8.15;L'OR  café sontuoso caja 20 cápsulas;L;0.41;€/ud.;['Despensa', 'Desayunos y dulces', 'Café'];;2023-01-06
187569;5.69;MAGNUM helado bombón after dinner frac caja 10 uds 290 gr;MAGNUM;19.62;€/Kg.;['Congelados', 'Helados'];;2023-01-06
97;0.73;Manzana golden unidad (380 gr aprox.);;1.91;€/Kg.;['Frescos', 'Frutas', 'Manzanas'];;2023-01-06
186645;1.17;DIA ambientador neutralizador aroma vainilla spray 300 ml;DIA;3.9;€/l.;['Cuidado del hogar', 'Ambientadores'];;2023-01-06
11466;1.72;Manzana roja bolsa 1 kg;;1.72;€/Kg.;['Frescos', 'Frutas', 'Manzanas'];;2023-01-06
130617P4;3.4;DIA HOLA COLA refresco de cola zero botella 2 lt PACK 4;DIA HOLA COLA;0.43;€/l.;['Bebidas', 'Refrescos'];;2023-01-06
183576;2.0;DIA DELICIOUS mermelada de ciruela y kiwi extra 60% fruta frasco 320 gr;DIA DELICIOUS;6.25;€/Kg.;['Despensa', 'Desayunos y dulces', 'Mermeladas. miel y frutas en almíbar'];;2023-01-06
6114;1.09;DIA estropajo salvauñas fibra blanca para baño paquete 2 uds;DIA;0.55;€/ud.;['Cuidado del hogar', 'Utensilios de limpieza'];;2023-01-06
283132;1.95;NATUR DACSA proteína texturizada de guisante bolsa 200 gr;NATUR DACSA;9.75;€/Kg.;['Despensa', 'Dietéticos', 'Complementos nutricionales'];;2023-01-06
270283;2.39;RIOJAVINA vinagre de manzana ecológico botella 500 ml;RIOJAVINA;4.78;€/l.;['Despensa', 'Aceites. vinagres y aliños', 'Vinagres y aliños'];;2023-01-06
179945;3.95;BONTE tinte Caoba Nº 5.6 caja 1 ud;BONTE;3.95;€/ud.;['Cuidado personal', 'Baño e higiene personal', 'Cuidado del cabello'];;2023-01-06
283026;1.79;DESTAPA LA HUERTA pimientos del piquillo rojos y verdes en tiras frasco 270 gr;DESTAPA LA HUERTA;6.51;€/Kg.;['Despensa', 'Conservas', 'Conservas vegetales'];;2023-01-06
282561;3.59;CALVO salmón al natural pack 3 latas de 45 gr;CALVO;26.59;€/Kg.;['Despensa', 'Conservas', 'Conservas de pescado'];;2023-01-06
278106;6.99;DIA DULCE NOEL roscón de Reyes premium capricho con nata caja 500 gr;DIA DULCE NOEL;13.98;€/Kg.;['Dulces de navidad', 'Roscones de reyes'];;2023-01-06
274202;1.05;BIFRUTAS PASCUAL bebida con leche mediterráneo natural botella 240 ml;BIFRUTAS PASCUAL;4.38;€/l.;['Bebidas', 'Zumos'];;2023-01-06
286237;0.7;Caldo desgrasado de verduras estuche 12 pastillas;;0.06;€/ud.;['Despensa', 'Sopas', 'Caldos'];;2023-01-06
273617;1.85;DIA VEGECAMPO aceitunas rellenas de anchoa suave pack 3 latas 50 gr;DIA VEGECAMPO;12.33;€/Kg.;['Despensa', 'Aperitivos'];;2023-01-06
230798;2.29;BONDUELLE maíz un toque pack 3 latas 70 gr;BONDUELLE;10.9;€/Kg.;['Despensa', 'Conservas', 'Conservas vegetales'];;2023-01-06
163932;1.89;FONT VELLA Levite limón botella 1.25 lt;FONT VELLA;1.51;€/l.;['Bebidas', 'Aguas'];;2023-01-06
89947;3.25;PRONTO limpia muebles spray 300 ml;PRONTO;10.83;€/l.;['Cuidado del hogar', 'Productos de limpieza', 'Hogar'];;2023-01-06
83913;2.29;NESTLE papilla líquida con galleta pack 2 unidades 250 ml;NESTLE;4.58;€/l.;['Bebé', 'Papillas'];;2023-01-06
275953;1.99;TOQUE ESPECIAL sal y hierbas molinillo 90 gr;TOQUE ESPECIAL;22.11;€/Kg.;['Despensa', 'Sal y especias'];;2023-01-06
262446;2.35;SANEX desodorante natur protect bambú roll on 50 ml;SANEX;47.0;€/l.;['Cuidado personal', 'Baño e higiene personal', 'Desodorantes'];;2023-01-06
3211;2.85;DANONE ACTIVIA bífidus natural 0% M.G pack 4 unidades 120 gr;DANONE ACTIVIA;5.94;€/Kg.;['Despensa', 'Lácteos y huevos', 'Yogures'];;2023-01-06
263506;3.59;SANEX desodorante natur protect invisible fresh spray 200 ml;SANEX;17.95;€/l.;['Cuidado personal', 'Baño e higiene personal', 'Desodorantes'];;2023-01-06
271182;4.85;VIVISIMA+ colágeno hidrolizado y magnesio lata 250 gr;VIVISIMA;19.4;€/Kg.;['Despensa', 'Dietéticos', 'Complementos nutricionales'];;2023-01-06
280279;1.0;FRUGO bebida energética wild pink lata 33 cl;FRUGO;3.03;€/l.;['Bebidas', 'Bebidas isotónicas y energéticas'];;2023-01-06
288045;2.35;DIA MARI MARINERA atún en aceite de oliva pack 3 latas de 52 gr;DIA MARI MARINERA;15.06;€/Kg.;['Despensa', 'Conservas', 'Conservas de pescado'];;2023-01-06
282605;0.99;DONNA DELICIA galletas rellenas con crema de avellanas caja 150 gr;DONNA DELICIA;6.6;€/Kg.;['Despensa', 'Desayunos y dulces', 'Galletas'];;2023-01-06
285683;0.95;REINA yogur natural rico en proteínas 0% M.G. vaso 180 gr;REINA;5.28;€/Kg.;['Despensa', 'Lácteos y huevos', 'Yogures'];;2023-01-06
221336;2.59;HEINZ mostaza suave bote 220 ml;HEINZ;11.77;€/l.;['Despensa', 'Salsas', 'Mayonesa y otras salsas'];;2023-01-06
267137;1.89;DIA AL PUNTO pisto de verduras con tomate bolsa 450 gr;DIA AL PUNTO;4.2;€/Kg.;['Congelados', 'Precocinados'];;2023-01-06
207235;3.95;MARCILLA café molido descafeinado natural gran aroma paquete 200 gr;MARCILLA;19.75;€/Kg.;['Despensa', 'Desayunos y dulces', 'Café'];;2023-01-06
275856;4.99;ALVINI licor de limoncello 25º botella 50 cl;ALVINI;9.98;€/l.;['Bodega', 'Licores', 'Otros licores'];;2023-01-06
76121;2.49;DANONE DANET natillas de chocolate pack 4 unidades 120 gr;DANONE DANET;5.19;€/Kg.;['Despensa', 'Lácteos y huevos', 'Postres'];;2023-01-06
283362;2.25;DIA FUNKY FRANK salchichas Viena de pollo pack 3 x 200 gr;DIA FUNKY FRANK;3.75;€/Kg.;['Frescos', 'Charcutería y quesos', 'Cocidos'];;2023-01-06
274390;5.49;DIA SELECCIÓN MUNDIAL lomos de salmón envase 250 gr;DIA SELECCIÓN MUNDIAL;21.96;€/Kg.;['Congelados', 'Pescado y marisco'];;2023-01-06
48888;1.15;DIA LACTEA bebida láctea omega 3 envase 1 lt;DIA LACTEA;1.15;€/l.;['Despensa', 'Lácteos y huevos', 'Leche'];;2023-01-06
278685;4.95;NATURAL HONEY loción corporal sensitive dosificador 400 ml;NATURAL HONEY;12.38;€/l.;['Cuidado personal', 'Cuidado corporal', 'Hidratación corporal'];;2023-01-06
265948;0.95;DIA VEGECAMPO guisantes medianos lata 265 gr;DIA VEGECAMPO;3.58;€/Kg.;['Despensa', 'Conservas', 'Conservas vegetales'];;2023-01-06
85271;2.05;CORNY barrita de cereales con chocolate con leche caja 150 gr;CORNY;13.67;€/Kg.;['Despensa', 'Desayunos y dulces', 'Cereales'];;2023-01-06
87364;5.38;FLOR DE ESGUEVA queso de oveja viejo cuña 250 g;FLOR DE ESGUEVA;21.52;€/Kg.;['Frescos', 'Charcutería y quesos', 'Quesos'];;2023-01-06
276629;1.99;JUVER zumo de frutas cítrico ayuda a tus defensas envase 1 lt;JUVER;1.99;€/l.;['Bebidas', 'Zumos'];;2023-01-06
285544;1.55;DIA SUPER PACO colgador para WC agua azul blíster 2 uds;DIA SUPER PACO;16.15;€/Kg.;['Cuidado del hogar', 'Productos de limpieza', 'Baño'];;2023-01-06
192P12;3.96;DIA RAMBLERS cerveza lager lata 33 cl PACK 12;DIA RAMBLERS;1.0;€/l.;['Bebidas', 'Cervezas', 'Nacionales'];;2023-01-06
282952;6.29;FRISKIES alimento para perros en gelatina multipack 12 x 100 gr;FRISKIES;5.24;€/Kg.;['Mascotas', 'Perros'];;2023-01-06
218460;2.95;DANONE ACTIVIA bífidus cremoso cocktail de frutas 0% M.G pack 4 uds 120 gr;DANONE ACTIVIA;6.15;€/Kg.;['Despensa', 'Lácteos y huevos', 'Yogures'];;2023-01-06
288198;2.0;SELECCIÓN DE DIA hamburguesas crispy chicken 2 uds 200 gr;SELECCIÓN DE DIA;10.0;€/Kg.;['Frescos', 'Carne', 'Pollo'];;2023-01-06
7772;12.99;JOHNNIE WALKER whisky red label botella 70 cl;JOHNNIE WALKER;18.56;€/l.;['Bodega', 'Alcoholes', 'Whisky'];;2023-01-06
271064;2.59;DIA TEMPTATION helado de vainilla con nueces de macadamia tarrina 350 gr;DIA TEMPTATION;7.4;€/Kg.;['Congelados', 'Helados'];;2023-01-06
167407;6.72;FONTE OS ANXOS  queso graso madurado pieza 600 gr;FONTE OS ANXOS;12.22;€/Kg.;['Frescos', 'Charcutería y quesos', 'Quesos'];;2023-01-06
108027;1.35;DANI nuez moscada molida frasco 45 g;DANI;30.0;€/Kg.;['Despensa', 'Sal y especias'];;2023-01-06
60020;2.39;WHISKAS alimento para gatos sabores del mar bolsa 4 x 100 gr;WHISKAS;5.98;€/Kg.;['Mascotas', 'Gatos'];;2023-01-06
239779;2.29;SUNBITES snack multicereales al toque de sal marina bolsa 95 gr;SUNBITES;24.11;€/Kg.;['Despensa', 'Aperitivos'];;2023-01-06
269072;3.05;BABARIA leche corporal vitamina C dosificador 500 ml;BABARIA;6.1;€/l.;['Cuidado personal', 'Cuidado corporal', 'Hidratación corporal'];;2023-01-06
138138;2.99;BARILLA salsa basílico frasco 400 gr;BARILLA;7.48;€/Kg.;['Despensa', 'Salsas', 'Mayonesa y otras salsas'];;2023-01-06
214697;1.99;TOQUE ESPECIAL sal rosa del Himalaya con molinillo frasco 100 gr;TOQUE ESPECIAL;19.9;€/Kg.;['Despensa', 'Sal y especias'];;2023-01-06
48666;1.31;EL MOLINO DE DIA pan de molde blanco sin corteza bolsa 450 gr;EL MOLINO DE DIA;2.91;€/Kg.;['Despensa', 'Pan', 'Pan de molde'];;2023-01-06
187165;2.09;DON SIMON zumo de melocotón. manzana y uva pack 6 unidades 200 ml;DON SIMON;1.74;€/l.;['Bebidas', 'Zumos'];;2023-01-06
160680;4.29;PURINA One alimento para perros mini con buey bolsa 800 gr;PURINA;5.36;€/Kg.;['Mascotas', 'Perros'];;2023-01-06
188444;4.39;VIA DE LA PLATA cava brut botella 75 cl;VIA DE LA PLATA;5.85;€/l.;['Bodega', 'Espumosos'];;2023-01-06
231657;1.89;BONTE champú cabello seco dosificador 750 ml;BONTE;2.52;€/l.;['Cuidado personal', 'Baño e higiene personal', 'Champús'];;2023-01-06
283650;2.69;GILLETTE espuma de afeitar clásica spray 200 ml;GILLETTE;13.45;€/l.;['Cuidado personal', 'Afeitado'];;2023-01-06
136921;8.99;FERRERO rocher bombones caja 300 gr;FERRERO;29.97;€/Kg.;['Despensa', 'Desayunos y dulces', 'Chocolates y bombones'];;2023-01-06
271800;17.99;GILLETTE fusion proglide maquinilla de afeitar recambio blíster 3 uds;GILLETTE;6.0;€/ud.;['Cuidado personal', 'Afeitado'];;2023-01-06
176399;1.05;BONTE cepillo dental de viaje medio 1 ud;BONTE;1.05;€/ud.;['Cuidado personal', 'Cuidado bucal'];;2023-01-06
232043;1.63;Ajo BIO malla 200 gr;BIO;8.15;€/Kg.;['Frescos', 'Verduras y hortalizas', 'Ajos. cebollas y puerros'];;2023-01-06
262685;2.49;DIA PATATAS UNIDAS patatas gajo bolsa 750 gr;DIA PATATAS UNIDAS;3.32;€/Kg.;['Congelados', 'Verduras y hortalizas'];;2023-01-06
288133;2.97;ENSALANDIA ensaladilla rusa tarrina 450 gr;ENSALANDIA;6.6;€/Kg.;['Platos preparados', 'Ensaladas'];;2023-01-06
16357;0.89;MAGGI pasta oriental pollo sobre 70 gr;MAGGI;12.71;€/Kg.;['Despensa', 'Cocina internacional', 'Oriental'];;2023-01-06
282421;2.95;PRECOMAR pimientos del piquillo rellenos de atún frasco 225 gr;PRECOMAR;13.11;€/Kg.;['Platos preparados', 'Verduras'];;2023-01-06
274986;0.75;VEGEDIA postre vegetal de avena con albaricoque vaso 150 gr;VEGEDIA;5.0;€/Kg.;['Despensa', 'Lácteos y huevos', 'Yogures'];;2023-01-06
233091;3.29;SANYTOL limpiador desinfectante cocinas pistola 750 ml;SANYTOL;4.39;€/l.;['Cuidado del hogar', 'Productos de limpieza', 'Hogar'];;2023-01-06
272033;3.55;DIA IMAQE mascarilla facial de arcilla con carbón activo tubo 100 ml;DIA IMAQE;35.5;€/l.;['Cuidado personal', 'Cuidado corporal', 'Crema facial'];;2023-01-06
122117;1.99;NESTEA refresco de té al limón sin azúcar botella 1.5 lt;NESTEA;1.33;€/l.;['Bebidas', 'Refrescos'];;2023-01-06
14277;2.45;DIA LACTEA yogur con frutas pack 8 unidades 125 gr;DIA LACTEA;2.45;€/Kg.;['Despensa', 'Lácteos y huevos', 'Yogures'];;2023-01-06
131302;2.26;AUSONIA compresas normal alas bolsa 14 uds;AUSONIA;0.16;€/ud.;['Cuidado personal', 'Cuidado íntimo'];;2023-01-06
6721;1.39;UBAGO filetes de caballa del sur en aceite de girasol lata 65 gr;UBAGO;21.38;€/Kg.;['Despensa', 'Conservas', 'Conservas de pescado'];;2023-01-06
264103;0.99;PASTORET yogur cremoso artesano de melocotón y maracuya tarrina 125 gr;PASTORET;7.92;€/Kg.;['Despensa', 'Lácteos y huevos', 'Yogures'];;2023-01-06
124858;1.39;DIA VEGECAMPO espárragos verdes delgados frasco 100 gr;DIA VEGECAMPO;13.9;€/Kg.;['Despensa', 'Conservas', 'Conservas vegetales'];;2023-01-06
28694;8.69;DOUREGAL whisky 5 años botella 70 cl;DOUREGAL;12.41;€/l.;['Bodega', 'Alcoholes', 'Whisky'];;2023-01-06
160270;11.95;NIVEA Q10 Energy crema de día antiarrugas vitamina C sfp 15 tarro 50 ml;NIVEA;239.0;€/l.;['Cuidado personal', 'Cuidado corporal', 'Crema facial'];;2023-01-06
89498;2.79;ORION pinzas antipolillas aroma lavanda fresca bolsa 2 uds;ORION;1.4;€/ud.;['Cuidado del hogar', 'Insecticidas'];;2023-01-06
282572;4.39;MICOLOR detergente máquina en cápsulas 10 uds;MICOLOR;0.44;€/Lavado;['Cuidado del hogar', 'Cuidado de la ropa'];;2023-01-06
73676P6;7.74;PASCUAL leche entera envase 1 lt PACK 6;PASCUAL;1.29;€/l.;['Despensa', 'Lácteos y huevos', 'Leche'];;2023-01-06
271744;1.99;DIA ICEBERG chicles de fresa bote 98 gr;DIA ICEBERG;1.99;€/ud.;['Despensa', 'Desayunos y dulces', 'Caramelos. chicles y golosinas'];;2023-01-06
73692;1.85;VIVESOY bebida de soja envase 1 lt;VIVESOY;1.85;€/l.;['Despensa', 'Lácteos y huevos', 'Bebidas vegetales'];;2023-01-06
222373;1.19;DIA MARI MARINERA sardinas picantonas lata 82 gr;DIA MARI MARINERA;14.51;€/Kg.;['Despensa', 'Conservas', 'Conservas de pescado'];;2023-01-06
266744;2.99;LA TOJA gel de ducha agua de coco y té verde bote 550 ml;LA TOJA;5.44;€/l.;['Cuidado personal', 'Baño e higiene personal', 'Geles de duchas y esponjas'];;2023-01-06
273609;2.09;DIA MARI MARINERA anchoas en aceite de girasol pack 3 uds 87 gr;DIA MARI MARINERA;24.02;€/Kg.;['Frescos', 'Pescado y marisco', 'Ahumados y salazones'];;2023-01-06
262220;1.59;TRIDENT Oral b chicle grageas sabor hierbabuena paquete 10 uds;TRIDENT;93.53;€/Kg.;['Despensa', 'Desayunos y dulces', 'Caramelos. chicles y golosinas'];;2023-01-06
19479;1.89;DIA TEMPTATION helado bombón classic caja 4 uds 336 gr;DIA TEMPTATION;5.63;€/Kg.;['Congelados', 'Helados'];;2023-01-06
187736;2.05;MONJAS lenguas de mantequilla paquete 200 gr;MONJAS;10.25;€/Kg.;['Despensa', 'Desayunos y dulces', 'Bollería'];;2023-01-06
154931;4.55;NATURAL HONEY loción corporal reparadora elixir de argán bote 330 ml;NATURAL HONEY;13.79;€/l.;['Cuidado personal', 'Cuidado corporal', 'Hidratación corporal'];;2023-01-06
261373;4.94;Filetes de pechuga de pollo corte extrafino bandeja (peso aprox. 550 gr);;8.99;€/Kg.;['Frescos', 'Carne', 'Pollo'];;2023-01-06
222326;2.19;DIA MARCELO CARAMELO golosinas cintas pica tarrina 300 gr;DIA MARCELO CARAMELO;7.3;€/Kg.;['Despensa', 'Desayunos y dulces', 'Caramelos. chicles y golosinas'];;2023-01-06
74399;2.55;HERO Baby buenas noches verduritas con pollo tarrito 2x190 gr;HERO;6.71;€/Kg.;['Bebé', 'Potitos y tarritos'];;2023-01-06
253749;2.25;CALVO filetes de caballa en aceite de oliva bajo en sal lata 82 gr;CALVO;27.44;€/Kg.;['Despensa', 'Conservas', 'Conservas de pescado'];;2023-01-06
1389;1.14;DIA VEGECAMPO menestra de verduras bolsa 1 kg;DIA VEGECAMPO;1.14;€/Kg.1,34 €/Kg.;['Congelados', 'Verduras y hortalizas'];;2023-01-06
100308;1.71;GALLO espaguetis al huevo paquete 450 gr;GALLO;3.8;€/Kg.;['Despensa', 'Pastas. harinas y masas', 'Pastas'];;2023-01-06
263201;6.79;WIPP EXPRESS detergente máquina 4 en 1 en cápsulas 20 uds;WIPP EXPRESS;0.34;€/Lavado;['Cuidado del hogar', 'Cuidado de la ropa'];;2023-01-06
220175;1.25;DIA GALLETECA galleta cubierta de chocolate con leche paquete 150 gr;DIA GALLETECA;8.33;€/Kg.;['Despensa', 'Desayunos y dulces', 'Galletas'];;2023-01-06
47090;1.59;PROFIDEN pasta dentífrica anticaries tubo 75 ml;PROFIDEN;21.2;€/l.;['Cuidado personal', 'Cuidado bucal'];;2023-01-06
144782;4.05;ARLUY mini galletas con sabor a chocolate paquete 500 gr;ARLUY;8.1;€/Kg.;['Despensa', 'Desayunos y dulces', 'Galletas'];;2023-01-06
233300;1.89;BONTE champú aguacate y karité antiencrespamiento bote 250 ml;BONTE;7.56;€/l.;['Cuidado personal', 'Baño e higiene personal', 'Champús'];;2023-01-06
265304;5.99;TOPAZ vino blanco Pedro Ximénez DO Jerez botella 75 cl;TOPAZ;7.99;€/l.;['Bodega', 'Vino', 'Generoso y dulce'];;2023-01-06
250728;2.39;PASCUAL leche entera pack 6 unidades 200 ml;PASCUAL;1.99;€/l.;['Despensa', 'Lácteos y huevos', 'Leche'];;2023-01-06
131262;1.05;DIA ZUMOSFERA zumo de naranja 100% sin pulpa envase 1 lt;DIA ZUMOSFERA;1.05;€/l.;['Bebidas', 'Zumos'];;2023-01-06
262208;4.99;COLGATE cepillo dental encías revitalizante blíster 1 ud;COLGATE;4.99;€/ud.;['Cuidado personal', 'Cuidado bucal'];;2023-01-06
222418;7.85;BARMON'S ginebra sabor fresa botella 70 cl;BARMON;11.21;€/l.;['Bodega', 'Alcoholes', 'Ginebra'];;2023-01-06
150915;1.99;GALLINA BLANCA caldo de pollo bajo en sal 100% natural envase 1 lt;GALLINA BLANCA;1.99;€/l.;['Despensa', 'Sopas', 'Caldos'];;2023-01-06
288256;1.49;TRAPA chocolate blanco 0% sin azúcares añadidos tableta 90 gr;TRAPA;16.56;€/Kg.;['Despensa', 'Desayunos y dulces', 'Chocolates y bombones'];;2023-01-06
286120;2.79;DIA VEGECAMPO garbanzos cocidos con trufa frasco 450 gr;DIA VEGECAMPO;6.2;€/Kg.;['Despensa', 'Arroz y legumbres', 'Legumbres'];;2023-01-06
161423;2.35;HERO mermelada fresa de temporada de Huelva frasco 350 gr;HERO;6.71;€/Kg.;['Despensa', 'Desayunos y dulces', 'Mermeladas. miel y frutas en almíbar'];;2023-01-06
160612;1.45;GALLINA BLANCA fideos orientales yatekomo pollo vaso 60 gr;GALLINA BLANCA;24.17;€/Kg.;['Despensa', 'Cocina internacional', 'Oriental'];;2023-01-06
15883;4.8;DIA ARROZONA arroz bomba paquete 1 Kg;DIA ARROZONA;4.8;€/Kg.;['Despensa', 'Arroz y legumbres', 'Arroz'];;2023-01-06
181197;2.45;LA VIEJA FABRICA Diet mermelada extra de naranja amarga frasco 300 gr;LA VIEJA FABRICA;8.45;€/Kg.;['Despensa', 'Desayunos y dulces', 'Mermeladas. miel y frutas en almíbar'];;2023-01-06
147811;3.79;NENUCO colonia spray 240ml;NENUCO;15.79;€/l.;['Bebé', 'Cuidado del bebé'];;2023-01-06
275652;2.99;DIA NATURMUNDO mix frutos secos fritos tarrina 200 gr;DIA NATURMUNDO;14.95;€/Kg.;['Despensa', 'Aperitivos'];;2023-01-06
274450;4.3;SMINT pastillas de menta sin azúcar lata 105 gr;SMINT;40.95;€/Kg.;['Despensa', 'Desayunos y dulces', 'Caramelos. chicles y golosinas'];;2023-01-06
281;0.99;DIA ZUMOSFERA zumo de manzana 100% envase 1 lt;DIA ZUMOSFERA;0.99;€/l.;['Bebidas', 'Zumos'];;2023-01-06
277678;2.69;BONDUELLE lunch bowl de garbanzos. zanahoria. maíz y quinoa bolsa 250 gr;BONDUELLE;10.76;€/Kg.;['Platos preparados', 'Legumbres'];;2023-01-06
21879;4.29;BERBERANA vino tinto de la tierra de Castila botella 75 cl;BERBERANA;5.72;€/l.;['Bodega', 'Vino', 'Tinto'];;2023-01-06
148433;1.0;CAMPOFRÍO chopped pork en lonchas sobre 105 gr;CAMPOFRÍO;9.52;€/Kg.;['Frescos', 'Charcutería y quesos', 'Cocidos'];;2023-01-06
261939;8.89;SAN MIGUEL cerveza magna pack 12 latas 33 cl;SAN MIGUEL;2.24;€/l.;['Bebidas', 'Cervezas', 'Especiales'];;2023-01-06
206422;4.39;DR. SCHAR merienda dietética pausa ciok paquete 350 gr;DR;12.54;€/Kg.;['Despensa', 'Desayunos y dulces', 'Bollería'];;2023-01-06
228908;1.22;BONTE compresa clásica normal sin alas plegada bolsa 18 uds;BONTE;0.07;€/ud.;['Cuidado personal', 'Cuidado íntimo'];;2023-01-06
290828;2.21;BABARIA Men desodorante black gold spray 200 ml;BABARIA;11.05;€/l.;['Cuidado personal', 'Baño e higiene personal', 'Desodorantes'];;2023-01-06
274589;0.75;DIA SUPER PACO agua de plancha botella 1 lt;DIA SUPER PACO;0.75;€/l.;['Cuidado del hogar', 'Cuidado de la ropa'];;2023-01-06
