product_id;price;product;brand;unit_price;units;categories;discount;date
269839;3.15;ASEVI quitagrasas desinfectante pistola 750 ml;ASEVI;4.2;€/l.;['Cuidado del hogar', 'Productos de limpieza', 'Cocina'];;2023-01-06
16263;4.99;LA COCINERA lasaña boloñesa caja 500 gr;LA COCINERA;9.98;€/Kg.;['Congelados', 'Precocinados'];;2023-01-06
18615;3.49;FRUCTIS Style espuma hidra rizos spray 300 ml;FRUCTIS;11.63;€/l.;['Cuidado personal', 'Baño e higiene personal', 'Cuidado del cabello'];;2023-01-06
275800;3.95;VALOR cacao puro 100% natural en polvo bote 250 gr;VALOR;15.8;€/Kg.;['Despensa', 'Desayunos y dulces', 'Cacao y cremas de cacao'];;2023-01-06
283879;4.95;CARIBICA mojito botella 70 cl;CARIBICA;7.07;€/l.;['Bodega', 'Alcoholes', 'Ron'];;2023-01-06
274870;1.59;GOURMET CAZORLA paté ibérico Oporto tarro 110 g;GOURMET CAZORLA;14.45;€/Kg.;['Despensa', 'Patés y foies'];;2023-01-06
31118;3.49;HEINZ Ketchup top down bote 400 gr;HEINZ;7.59;€/Kg.;['Despensa', 'Salsas', 'Mayonesa y otras salsas'];;2023-01-06
269073;3.05;BABARIA leche corporal vitamina E dosificador 500 ml;BABARIA;6.1;€/l.;['Cuidado personal', 'Cuidado corporal', 'Hidratación corporal'];;2023-01-06
283069;1.79;TOP CAO crema de cacao con 13% de avellanas vaso 200 gr;TOP CAO;8.95;€/Kg.;['Despensa', 'Desayunos y dulces', 'Cacao y cremas de cacao'];;2023-01-06
144030;1.29;BURN bebida energética lata 50 cl;BURN;2.58;€/l.;['Bebidas', 'Bebidas isotónicas y energéticas'];;2023-01-06
51066;1.35;DIA edulcorante en polvo bote 75 gr;DIA;18.0;€/Kg.;['Despensa', 'Desayunos y dulces', 'Azúcar y edulcorantes'];;2023-01-06
273761;1.91;Nuez premium malla 330 gr;;6.37;€/Kg.;['Despensa', 'Aperitivos'];;2023-01-06
207804;2.25;ALIÑA TU DIA crema de vinagre con Pedro Ximénez bote 250 ml;ALIÑA TU DIA;9.0;€/l.;['Despensa', 'Aceites. vinagres y aliños', 'Vinagres y aliños'];;2023-01-06
161432;2.35;HERO mermelada melocotón de temporada frasco 350 gr;HERO;6.71;€/Kg.;['Despensa', 'Desayunos y dulces', 'Mermeladas. miel y frutas en almíbar'];;2023-01-06
107434;14.99;NIDINA leche infantil 2 bote 800 gr;NIDINA;18.74;€/Kg.;['Bebé', 'Leche para bebés'];;2023-01-06
234278;5.79;CILLIT BANG limpiador suciedad humedad pistola 750 ml;CILLIT BANG;7.72;€/l.;['Cuidado del hogar', 'Productos de limpieza', 'Hogar'];;2023-01-06
91974;2.09;HUESITOS barrita chocolate pack 10 uds;HUESITOS;10.45;€/Kg.;['Despensa', 'Desayunos y dulces', 'Chocolates y bombones'];;2023-01-06
243848;1.99;MONSTER bebida energética green lata 55.3 cl;MONSTER;3.6;€/l.;['Bebidas', 'Bebidas isotónicas y energéticas'];;2023-01-06
276676;2.99;DIA LA LLAMA papel higiénico 2 capas paquete 12 uds;DIA LA LLAMA;0.25;€/ud.;['Cuidado del hogar', 'Papel'];;2023-01-06
274261;6.25;VALDERIVERO vino tinto roble DO Ribera del Duero botella 75 cl;VALDERIVERO;8.33;€/l.;['Bodega', 'Vino', 'Tinto'];;2023-01-06
278899;1.82;Calabaza a dados envase 500 gr;;3.64;€/Kg.;['Frescos', 'Verduras y hortalizas', 'Calabacín. calabaza y berenjena'];;2023-01-06
284677;10.69;ULTIMA Nature alimento para perros mini con salmón bolsa 1.25 Kg;ULTIMA;8.55;€/Kg.;['Mascotas', 'Perros'];;2023-01-06
286186;1.2;4MOVE bebida isotónica multifrutas botella 750 ml;;1.6;€/l.;['Bebidas', 'Bebidas isotónicas y energéticas'];;2023-01-06
77746;0.79;CABREIROA agua mineral natural botella 1.5 lt;CABREIROA;0.53;€/l.;['Bebidas', 'Aguas'];;2023-01-06
160671;4.79;CESAR Selección especial alimento para perros completo multipack 4 x 150 gr;CESAR;7.98;€/Kg.;['Mascotas', 'Perros'];;2023-01-06
113374;1.69;DIA BIFIDUS cremoso natural desnatado 0% pack 8 unidades 125 gr;DIA BIFIDUS;1.69;€/Kg.;['Despensa', 'Lácteos y huevos', 'Yogures'];;2023-01-06
154331;2.95;HORNIMANS infusión manzanilla con anís estuche 25 bolsitas;HORNIMANS;0.12;€/ud.;['Despensa', 'Desayunos y dulces', 'Infusiones'];;2023-01-06
231076;5.99;HS champú anticaspa citrus fresh cabello graso bote 510 ml;HS;11.75;€/l.;['Cuidado personal', 'Baño e higiene personal', 'Champús'];;2023-01-06
37114;2.29;CASA TARRADELLAS espetec extra pieza 180 gr;CASA TARRADELLAS;12.72;€/Kg.;['Frescos', 'Charcutería y quesos', 'Curados'];;2023-01-06
209164;1.99;DIA SALSEO mayonesa bote 500 ml;DIA SALSEO;3.98;€/l.;['Despensa', 'Salsas', 'Mayonesa y otras salsas'];;2023-01-06
269003;2.59;BONDUELLE tus recetas rústicas lata 300 gr;BONDUELLE;8.63;€/Kg.;['Despensa', 'Conservas', 'Conservas vegetales'];;2023-01-06
151592;2.99;NIVEA Men desodorante invisible power spray 200 ml;NIVEA;14.95;€/l.;['Cuidado personal', 'Baño e higiene personal', 'Desodorantes'];;2023-01-06
54127;0.85;DIA caldo pollo casero envase 1 lt;DIA;0.85;€/l.;['Despensa', 'Sopas', 'Caldos'];;2023-01-06
273835;1.2;DIA IMAQE jabón de manos líquido almendra y miel dosificador 500 ml;DIA IMAQE;2.4;€/l.;['Cuidado personal', 'Baño e higiene personal', 'Jabón'];;2023-01-06
155675;6.55;BUSTAMANTE colonia muy mío frasco 100 ml;BUSTAMANTE;65.5;€/l.;['Cuidado personal', 'Baño e higiene personal', 'Colonias'];;2023-01-06
247002;1.5;DON SIMON vino blanco pack 3 unidades 187 ml;DON SIMON;2.67;€/l.;['Bodega', 'Vinos de mesa. sangrías y tintos de verano'];;2023-01-06
212874;2.15;DIA DELICIOUS mermelada extra de arándanos frasco 320 gr;DIA DELICIOUS;6.72;€/Kg.;['Despensa', 'Desayunos y dulces', 'Mermeladas. miel y frutas en almíbar'];;2023-01-06
174509;8.99;AIRWICK ambientador freshmatic flores blancas recambio 2 uds;AIRWICK;4.5;€/ud.;['Cuidado del hogar', 'Ambientadores'];;2023-01-06
286142;3.68;LA MOLISANA espaguetis con tinta de calamar paquete 500 gr;LA MOLISANA;7.36;€/Kg.;['Despensa', 'Pastas. harinas y masas', 'Pastas'];;2023-01-06
86202;1.99;DON SIMON zumo de naranja exprimida con pulpa 1 lt;DON SIMON;1.99;€/l.;['Bebidas', 'Zumos'];;2023-01-06
129425;1.35;DIA SALSEO salsa césar bote 300 ml;DIA SALSEO;4.5;€/l.;['Despensa', 'Salsas', 'Mayonesa y otras salsas'];;2023-01-06
12297;4.22;Patata lavada malla 3 Kg;;1.41;€/Kg.;['Frescos', 'Verduras y hortalizas', 'Patatas y zanahorias'];;2023-01-06
265764;1.89;NESTLE Junior leche crecimiento con cereales +3 años envase 1 lt;NESTLE;1.89;€/l.;['Despensa', 'Lácteos y huevos', 'Leche'];;2023-01-06
246136;1.45;DIA AL PUNTO gazpacho suave envase 1 lt;DIA AL PUNTO;1.45;€/l.;['Platos preparados', 'Gazpachos y salmorejos'];;2023-01-06
155687;20.95;L'OREAL Revitalift laser crema de día triple acción antiedad tarro 50 ml;L;419.0;€/l.;['Cuidado personal', 'Cuidado corporal', 'Crema facial'];;2023-01-06
184569;3.59;DIA MARI MARINERA anchoa del Cantábrico MSC en aceite de oliva lata 50 gr;DIA MARI MARINERA;71.8;€/Kg.;['Frescos', 'Pescado y marisco', 'Ahumados y salazones'];;2023-01-06
264764;5.99;MARCILLA café intenso 20 cápsulas caja 104 gr;MARCILLA;0.3;€/ud.;['Despensa', 'Desayunos y dulces', 'Café'];;2023-01-06
269522;5.59;HEREDAD BARÁN vino tinto crianza D.O. Ribera del Duero botella 75 cl;HEREDAD BARÁN;7.45;€/l.;['Bodega', 'Vino', 'Tinto'];;2023-01-06
272513;1.69;DIA FIDIAS yogur griego con nueces pack 4 unidades 125 gr;DIA FIDIAS;3.38;€/Kg.;['Despensa', 'Lácteos y huevos', 'Yogures'];;2023-01-06
155545;4.59;COLOR SENSATION tinte Negro Azulado Nº 2.1 caja 1 ud;COLOR SENSATION;4.59;€/ud.;['Cuidado personal', 'Baño e higiene personal', 'Cuidado del cabello'];;2023-01-06
151682;2.09;LICOR DEL POLO Junior pasta dentífrica fresa 1-6 años tubo 50 ml;LICOR DEL POLO;41.8;€/l.;['Cuidado personal', 'Cuidado bucal'];;2023-01-06
283609;1.55;DIA ZUMOSFERA bebida refrescante sabor mojito botella 1 lt;DIA ZUMOSFERA;1.55;€/l.;['Bebidas', 'Refrescos'];;2023-01-06
275004;1.29;DIA SELECCIÓN MUNDIAL tortiglioni paquete 500 gr;DIA SELECCIÓN MUNDIAL;2.58;€/Kg.;['Despensa', 'Pastas. harinas y masas', 'Pastas'];;2023-01-06
263820;0.56;DIA VEGECAMPO espinacas cortadas bolsa 450 gr;DIA VEGECAMPO;1.24;€/Kg.1,91 €/Kg.;['Congelados', 'Verduras y hortalizas'];;2023-01-06
107385;1.89;FONTANEDA OSITO LULU bizcocho rellenas de chocolate paquete 150 gr;FONTANEDA OSITO LULU;12.6;€/Kg.;['Despensa', 'Desayunos y dulces', 'Bollería'];;2023-01-06
125277;10.49;MOSKOVSKAYA vodka botella 70 cl;MOSKOVSKAYA;14.99;€/l.;['Bodega', 'Alcoholes', 'Vodka'];;2023-01-06
118111;1.0;NAVIDUL jamón curado en lonchas 50 gr;NAVIDUL;20.0;€/Kg.;['Frescos', 'Charcutería y quesos', 'Curados'];;2023-01-06
210717;12.99;GORDONS ginebra botella 1 lt;GORDONS;12.99;€/l.;['Bodega', 'Alcoholes', 'Ginebra'];;2023-01-06
245460;0.99;SUAVIPIEL esponja infantil patrulla canina bolsa 1 ud (modelo aleatorio);SUAVIPIEL;0.99;€/ud.1,65 €/ud.;['Cuidado personal', 'Baño e higiene personal', 'Geles de duchas y esponjas'];;2023-01-06
277825;2.45;DIA FRUTICAMPO carne de membrillo bandeja 250 gr;DIA FRUTICAMPO;9.8;€/Kg.;['Despensa', 'Desayunos y dulces', 'Mermeladas. miel y frutas en almíbar'];;2023-01-06
19577;8.79;AIRWICK ambientador automático fresh matic nenuco aparato + recambio 1 ud;AIRWICK;8.79;€/ud.;['Cuidado del hogar', 'Ambientadores'];;2023-01-06
261770;2.39;DIA TEMPTATION helado mini bombón mix caja 12 uds 432 gr;DIA TEMPTATION;5.53;€/Kg.;['Congelados', 'Helados'];;2023-01-06
247528;1.29;ORLANDO salsa brava bote 290 gr;ORLANDO;4.45;€/Kg.;['Despensa', 'Salsas', 'Mayonesa y otras salsas'];;2023-01-06
261680;9.49;ULTIMA Nature alimento para perros mini adultos con pollo bolsa 1.25 kg;ULTIMA;7.59;€/Kg.;['Mascotas', 'Perros'];;2023-01-06
221429;2.89;FRIT RAVICH cocktail picante bolsa 360 gr;FRIT RAVICH;8.03;€/Kg.;['Despensa', 'Aperitivos'];;2023-01-06
1015;0.95;Pepino holandés pieza (390 gr aprox.);;2.92;€/Kg.;['Frescos', 'Verduras y hortalizas', 'Tomates. pimientos y pepinos'];;2023-01-06
271601;3.19;HS champú anticaspa menthol fresh bote 230 ml;HS;13.87;€/l.;['Cuidado personal', 'Baño e higiene personal', 'Champús'];;2023-01-06
273732;2.79;DIA NUESTRA ALACENA pechuga de pavo sandwich envase 250 gr;DIA NUESTRA ALACENA;11.16;€/Kg.;['Frescos', 'Charcutería y quesos', 'Cocidos'];;2023-01-06
248782;2.75;ALPRO yogur natural con avena vaso 500 gr;ALPRO;5.5;€/Kg.;['Despensa', 'Lácteos y huevos', 'Yogures'];;2023-01-06
279226;2.49;SOÑADOR licor de manzana sin alcohol botella 70 cl;SOÑADOR;3.56;€/l.;['Bodega', 'Licores', 'Sin alcohol'];;2023-01-06
283927;15.49;ARIEL detergente en polvo básico Ariel 55 lavados;ARIEL;0.28;€/Lavado;['Cuidado del hogar', 'Cuidado de la ropa'];;2023-01-06
84027;1.69;BICENTURY tortitas de maíz bolsa 130 gr;BICENTURY;13.0;€/Kg.;['Despensa', 'Dietéticos', 'Pérdida de peso'];;2023-01-06
263220;2.39;DIA SELECCIÓN MUNDIAL queso emmental en lonchas sobre 200 gr;DIA SELECCIÓN MUNDIAL;11.95;€/Kg.;['Frescos', 'Charcutería y quesos', 'Quesos'];;2023-01-06
287793;1.39;FRISA pimientos del piquillo rellenos de bacalao envase 135 gr;FRISA;10.3;€/Kg.;['Congelados', 'Precocinados'];;2023-01-06
273616;1.45;DIA VEGECAMPO aceitunas rellenas de limón lata 150 gr;DIA VEGECAMPO;9.67;€/Kg.;['Despensa', 'Aperitivos'];;2023-01-06
247196;7.28;Filete de dorada bandeja (peso aprox. 350 gr);;20.8;€/Kg.;['Frescos', 'Pescado y marisco', 'Pescado y marisco fresco'];;2023-01-06
219664;3.79;VIVISIMA+ carnitina más magnesio caja 40 cápsulas;VIVISIMA;0.09;€/ud.;['Despensa', 'Dietéticos', 'Complementos nutricionales'];;2023-01-06
287566;2.25;RECONDO chapata rústica paquete 180 gr;RECONDO;12.5;€/Kg.;['Despensa', 'Pan', 'Biscotes'];;2023-01-06
256430;2.49;MAHOU BARRICA cerveza bourbon botella 33 cl;MAHOU BARRICA;7.55;€/l.;['Bebidas', 'Cervezas', 'Especiales'];;2023-01-06
269405;1.09;DIA SUPER PACO friegasuelos aroma spa botella 1.5 lt;DIA SUPER PACO;0.73;€/l.;['Cuidado del hogar', 'Productos de limpieza', 'Hogar'];;2023-01-06
148419;4.59;PALETTE INTENSIVE CREME tinte Negro Azulado Nº 1.1 caja 1 ud;PALETTE INTENSIVE CREME;4.59;€/ud.;['Cuidado personal', 'Baño e higiene personal', 'Cuidado del cabello'];;2023-01-06
184422;4.89;DOLCE GUSTO grande intenso caja 16 cápsulas;DOLCE GUSTO;0.31;€/ud.;['Despensa', 'Desayunos y dulces', 'Café'];;2023-01-06
165867;2.89;DANONE OIKOS yogur griego natural pack 4 unidades 110 gr;DANONE OIKOS;6.57;€/Kg.;['Despensa', 'Lácteos y huevos', 'Yogures'];;2023-01-06
28245;1.99;ISABEL mejillones en escabeche 13/18 piezas lata 69 gr;ISABEL;28.84;€/Kg.;['Despensa', 'Conservas', 'Conservas de pescado'];;2023-01-06
286144;1.39;KELSIA quitaesmalte con acetona pura bote 200 ml;KELSIA;6.95;€/l.;['Cuidado personal', 'Cuidado corporal', 'Cosmética'];;2023-01-06
244889;4.19;NORIT detergente a mano líquido cuidado delicado botella 45 lv;NORIT;0.09;€/Lavado;['Cuidado del hogar', 'Cuidado de la ropa'];;2023-01-06
161247;6.23;OB tampón digital super caja 32 uds;OB;0.19;€/ud.;['Cuidado personal', 'Cuidado íntimo'];;2023-01-06
273960;1.29;DIA NUESTRA ALACENA mortadela en lonchas envase 250 gr;DIA NUESTRA ALACENA;5.16;€/Kg.;['Frescos', 'Charcutería y quesos', 'Cocidos'];;2023-01-06
278848;6.99;BEN&JERRY helado the fan favourites collection pack 4 uds 100 ml;BEN;17.48;€/l.;['Congelados', 'Helados'];;2023-01-06
28235;0.87;COCA-COLA zero lata 33 cl;COCA;2.64;€/l.;['Bebidas', 'Refrescos'];;2023-01-06
270772;3.95;GLISS champú split hair miracle cabello encrespado bote 370 ml;GLISS;10.68;€/l.;['Cuidado personal', 'Baño e higiene personal', 'Champús'];;2023-01-06
197;3.9;DIA cacao instantaneo bote 800 gr;DIA;4.88;€/Kg.;['Despensa', 'Desayunos y dulces', 'Cacao y cremas de cacao'];;2023-01-06
236267;4.39;DIA TEMPTATION surtido bombón belga caja 200 gr (modelo aleatorio);DIA TEMPTATION;21.95;€/Kg.;['Despensa', 'Desayunos y dulces', 'Chocolates y bombones'];;2023-01-06
273360;1.69;GALLINA BLANCA avecrem caldo de pollo 100% natural estuche 90 gr;GALLINA BLANCA;18.78;€/Kg.;['Despensa', 'Sopas', 'Caldos'];;2023-01-06
76048;7.3;VIÑA MAYOR  vino tinto  DO Ribera de Duero botella 75 cl;VIÑA MAYOR;9.73;€/l.;['Bodega', 'Vino', 'Tinto'];;2023-01-06
291719;3.19;TERRANOVA tortillitas de camarón bolsa 400 gr;TERRANOVA;7.98;€/Kg.;['Congelados', 'Precocinados'];;2023-01-06
102921;6.15;EL COTO vino tinto crianza DO Rioja botella 75 cl;EL COTO;8.2;€/l.;['Bodega', 'Vino', 'Tinto'];;2023-01-06
272361;4.99;MOURAMA vino blanco DO Ribeiro botella 75 cl;MOURAMA;6.65;€/l.;['Bodega', 'Vino', 'Blanco'];;2023-01-06
59626;0.72;DIA amoniaco perfumado botella 1.5 lt;DIA;0.48;€/l.;['Cuidado del hogar', 'Productos de limpieza', 'Hogar'];;2023-01-06
273997;4.19;DIA SUPER PACO detergente máquina líquido marsella botella 46 lv;DIA SUPER PACO;0.09;€/Lavado;['Cuidado del hogar', 'Cuidado de la ropa'];;2023-01-06
221311;0.95;DIA ZUMOSFERA zumo de tomate 100% envase 1 lt;DIA ZUMOSFERA;0.95;€/l.;['Bebidas', 'Zumos'];;2023-01-06
68041;0.75;DIA yogur con melocotón y maracuya vaso 200 gr;DIA;3.75;€/Kg.;['Despensa', 'Lácteos y huevos', 'Yogures'];;2023-01-06
166119;2.85;DANONE ACTIVIA bífidus natural azucarado pack 4 unidades 120 gr;DANONE ACTIVIA;5.94;€/Kg.;['Despensa', 'Lácteos y huevos', 'Yogures'];;2023-01-06
116710;5.5;MIKANOFF vodka con sabor a caramelo botella 70 cl;MIKANOFF;7.86;€/l.;['Bodega', 'Alcoholes', 'Vodka'];;2023-01-06
275644;3.29;DIA AL PUNTO fingers de pollo bolsa 400 gr;DIA AL PUNTO;8.23;€/Kg.;['Congelados', 'Precocinados'];;2023-01-06
268404;7.59;DIA PLANETA BEBE pañales 8-15 kgs talla 4 paquete 44 uds;DIA PLANETA BEBE;0.17;€/ud.;['Bebé', 'Pañales'];;2023-01-06
282883;0.99;DIA SNACK MANIAC pipas gigantes sin sal bolsa 125 gr;DIA SNACK MANIAC;7.92;€/Kg.;['Despensa', 'Aperitivos'];;2023-01-06
263267;1.49;DIA VEGECAMPO judías verdes planas bolsa 1 Kg;DIA VEGECAMPO;1.49;€/Kg.;['Congelados', 'Verduras y hortalizas'];;2023-01-06
171012;1.79;PANCELIAC picos artesanos SIN GLUTEN 100 gr;PANCELIAC;17.9;€/Kg.;['Despensa', 'Pan', 'Picos de pan'];;2023-01-06
271046;5.21;JAENCOOP aceite de oliva virgen extra primera cosecha botella 500 ml;JAENCOOP;10.42;€/l.;['Despensa', 'Aceites. vinagres y aliños', 'Aceites'];;2023-01-06
172850;1.15;DIA VEGECAMPO alcaparras en vinagre frasco 80 gr;DIA VEGECAMPO;14.37;€/Kg.;['Despensa', 'Aperitivos'];;2023-01-06
287948;3.4;NELLY laca fijación fuerte spray 600 ml;NELLY;5.67;€/l.;['Cuidado personal', 'Baño e higiene personal', 'Cuidado del cabello'];;2023-01-06
207883;4.05;ARTIACH Dinosaurus galletas de cereales con chocolate y leche caja 340 gr;ARTIACH;11.91;€/Kg.;['Despensa', 'Desayunos y dulces', 'Galletas'];;2023-01-06
268862;2.59;YOPRO yogur líquido proteínas sabor fresa botella 300 gr;YOPRO;8.63;€/Kg.;['Despensa', 'Lácteos y huevos', 'Yogures'];;2023-01-06
189013;2.35;BRILLANTE arroz redondo tradicional vaso 2 x 200 gr;BRILLANTE;5.88;€/Kg.;['Despensa', 'Arroz y legumbres', 'Arroz'];;2023-01-06
227303;2.41;BONTE compresas ultra normal alas bolsa 28 uds;BONTE;0.09;€/ud.;['Cuidado personal', 'Cuidado íntimo'];;2023-01-06
51028;1.97;DIA ambientador mini spray aroma explosión floral aparato + recambio 1 ud;DIA;1.97;€/ud.;['Cuidado del hogar', 'Ambientadores'];;2023-01-06
274001;8.49;DIA SUPER PACO detergente máquina líquido blanco&color botella 61 lv;DIA SUPER PACO;0.14;€/Lavado;['Cuidado del hogar', 'Cuidado de la ropa'];;2023-01-06
173903;2.19;ASTURIANA leche semidesnatada botella 2.2 lt;ASTURIANA;1.0;€/l.;['Despensa', 'Lácteos y huevos', 'Leche'];;2023-01-06
275389;2.55;CUCA atún claro en aceite de oliva virgen extra ecológico lata 82 gr;CUCA;31.1;€/Kg.;['Despensa', 'Conservas', 'Conservas de pescado'];;2023-01-06
129001;1.55;DIA CAPRICHOSO natillas sabor chocolate pack 6 unidades 125 gr;DIA CAPRICHOSO;2.07;€/Kg.;['Despensa', 'Lácteos y huevos', 'Postres'];;2023-01-06
283733;3.05;NIKE colonia urban wood man spray 30 ml;NIKE;101.67;€/l.;['Cuidado personal', 'Baño e higiene personal', 'Colonias'];;2023-01-06
262209;3.49;SANEX desodorante zero % extra control spray 200 ml;SANEX;17.45;€/l.;['Cuidado personal', 'Baño e higiene personal', 'Desodorantes'];;2023-01-06
48912;3.15;NESTLE Caja roja mini bombones caja 100 gr;NESTLE;31.5;€/Kg.;['Despensa', 'Desayunos y dulces', 'Chocolates y bombones'];;2023-01-06
28809;1.72;DIA ARROZONA arroz vaporizado paquete 1 Kg;DIA ARROZONA;1.72;€/Kg.;['Despensa', 'Arroz y legumbres', 'Arroz'];;2023-01-06
289631;0.89;RENOVA servilleta blanca 1 capa paquete 70 uds;RENOVA;0.89;€/ud.;['Cuidado del hogar', 'Papel'];;2023-01-06
291486;6.99;LUXIDERMIA calcetín exfoliante para pies envase 2 uds;LUXIDERMIA;3.5;€/ud.;['Cuidado personal', 'Cuidado corporal', 'Cuidado de manos y pies'];;2023-01-06
144684;2.89;KINDER Bueno white chocolate blanco pack 3 unidades 117 gr;KINDER;24.7;€/Kg.;['Despensa', 'Desayunos y dulces', 'Chocolates y bombones'];;2023-01-06
49862;2.99;TOBLERONE chocolate con leche pack 3 unidades 50 gr;TOBLERONE;19.93;€/Kg.;['Despensa', 'Desayunos y dulces', 'Chocolates y bombones'];;2023-01-06
285395;3.97;HEURA nuggets originales bandeja 180 gr;HEURA;22.06;€/Kg.;['Platos preparados', 'Carne'];;2023-01-06
290036;3.69;VERNEL suavizante concentrado cielo azul botella 70 lv;VERNEL;0.05;€/Lavado;['Cuidado del hogar', 'Cuidado de la ropa'];;2023-01-06
207279;1.95;AS barritas con verduras para roedores bolsa 2 uds;AS;17.73;€/Kg.;['Mascotas', 'Otros animales'];;2023-01-06
277830;1.15;DIA SNACK MANIAC palomitas de maíz con sal bolsa 80 gr;DIA SNACK MANIAC;14.37;€/Kg.;['Despensa', 'Aperitivos'];;2023-01-06
280015;2.39;BONTE mascarilla capilar color protect tarro 300 ml;BONTE;7.97;€/l.;['Cuidado personal', 'Baño e higiene personal', 'Cuidado del cabello'];;2023-01-06
204979;1.99;DANONE VITALINEA yogur desnatado sabor fresa pack 4 unidades 125 gr;DANONE VITALINEA;3.98;€/Kg.;['Despensa', 'Lácteos y huevos', 'Yogures'];;2023-01-06
285830;1.52;DIA SELECCIÓN MUNDIAL pasta mezze maniche bolsa 500 gr;DIA SELECCIÓN MUNDIAL;3.04;€/Kg.;['Despensa', 'Pastas. harinas y masas', 'Pastas'];;2023-01-06
289542;1.45;GALICA almejón natural lata 63 gr;GALICA;23.02;€/Kg.;['Despensa', 'Conservas', 'Conservas de pescado'];;2023-01-06
135902;1.19;EL MOLINO DE DIA panecillos tostados con tomate y orégano bolsa 160 gr;EL MOLINO DE DIA;7.44;€/Kg.;['Despensa', 'Pan', 'Snack de pan'];;2023-01-06
205748;1.95;DIA LACTEA yogur líquido fresa y plátano pack 4 botellas 180 gr;DIA LACTEA;2.71;€/Kg.;['Despensa', 'Lácteos y huevos', 'Yogures'];;2023-01-06
50664;2.98;Repollo liso unidad (2.4 Kg aprox.);;1.24;€/Kg.;['Frescos', 'Verduras y hortalizas', 'Brócolis y coliflores'];;2023-01-06
272911;0.69;PEPSI Max zero sin cafeína lata 33 cl;PEPSI;2.09;€/l.;['Bebidas', 'Refrescos'];;2023-01-06
271001;6.19;ASTURIANA mantequilla tradicional en rulo envase 500 gr;ASTURIANA;12.38;€/Kg.;['Despensa', 'Lácteos y huevos', 'Mantequilla y margarina'];;2023-01-06
267268;1.89;GREFUSA pipas el piponazo bolsa 119 gr;GREFUSA;15.88;€/Kg.;['Despensa', 'Aperitivos'];;2023-01-06
177166;6.99;PATA NEGRA vino tinto roble DO Ribera del Duero botella 75 cl;PATA NEGRA;9.32;€/l.;['Bodega', 'Vino', 'Tinto'];;2023-01-06
127938;2.29;PEDIGREE snack para perros mini dentastix bolsa 110 gr;PEDIGREE;20.82;€/Kg.;['Mascotas', 'Perros'];;2023-01-06
27955;1.59;DIA CAPRICHOSO copa de vainilla con caramelo y nata pack 4 uds 115 gr;DIA CAPRICHOSO;3.46;€/Kg.;['Despensa', 'Lácteos y huevos', 'Postres'];;2023-01-06
263619;2.55;DIA AL PUNTO pizza barbacoa envase 425 gr;DIA AL PUNTO;6.0;€/Kg.;['Platos preparados', 'Pizzas refrigeradas'];;2023-01-06
59304;0.65;EL MOLINO DE DIA picos integrales bolsa 250 gr;EL MOLINO DE DIA;2.6;€/Kg.;['Despensa', 'Pan', 'Picos de pan'];;2023-01-06
124812;2.39;BRIOCHE PASQUIER pan de leche bolsa 280 gr;BRIOCHE PASQUIER;8.54;€/Kg.;['Despensa', 'Desayunos y dulces', 'Bollería'];;2023-01-06
49869;3.39;NUTELLA crema de cacao con avellanas tarro 350 gr;NUTELLA;9.69;€/Kg.;['Despensa', 'Desayunos y dulces', 'Cacao y cremas de cacao'];;2023-01-06
245467;2.55;MELITTA filtro 1x4 para café caja 40 uds;MELITTA;0.06;€/ud.;['Cuidado del hogar', 'Bazar'];;2023-01-06
182;0.75;MAHOU 5 ESTRELLAS cerveza lata 33 cl;MAHOU;2.27;€/l.;['Bebidas', 'Cervezas', 'Nacionales'];;2023-01-06
251133;5.99;SYOSS tinte Rubio Claro Ceniza Nº 10-50 caja 1 ud;SYOSS;5.99;€/ud.;['Cuidado personal', 'Baño e higiene personal', 'Cuidado del cabello'];;2023-01-06
290597;2.99;GALLO caldo natural de cocido envase 2 x 1 lt;GALLO;2.99;€/l.;['Despensa', 'Sopas', 'Caldos'];;2023-01-06
267619;2.19;NEUTROMED jabón líquido de manos antibacteriano dosificador 300 ml;NEUTROMED;7.3;€/l.;['Cuidado personal', 'Baño e higiene personal', 'Jabón'];;2023-01-06
198262;1.89;HARIBO golosinas de regaliz black edition bolsa 150 gr;HARIBO;12.6;€/Kg.;['Despensa', 'Desayunos y dulces', 'Caramelos. chicles y golosinas'];;2023-01-06
275008;1.69;DIA CAPRICHOSO arroz con leche tarrina 450 gr;DIA CAPRICHOSO;3.76;€/Kg.;['Despensa', 'Lácteos y huevos', 'Postres'];;2023-01-06
51633;1.99;DIA VEGECAMPO champiñón laminado pack 3 latas 315 gr;DIA VEGECAMPO;6.32;€/Kg.;['Despensa', 'Conservas', 'Conservas vegetales'];;2023-01-06
39255;3.95;CALVO atún claro en aceite de oliva bajo en sal pack 3 latas de 52 gr;CALVO;25.32;€/Kg.;['Despensa', 'Conservas', 'Conservas de pescado'];;2023-01-06
283028;2.05;DULCESOL croissants rellenos de crema de leche y avellanas paquete 294 gr;DULCESOL;6.97;€/Kg.;['Despensa', 'Desayunos y dulces', 'Bollería'];;2023-01-06
268406;8.19;DIA PLANETA BEBE pañales 17-28 kgs talla 6 paquete 28 uds;DIA PLANETA BEBE;0.29;€/ud.;['Bebé', 'Pañales'];;2023-01-06
61052;2.35;DIA caramelos sin azúcar menta bolsa 200 gr;DIA;11.75;€/Kg.;['Despensa', 'Desayunos y dulces', 'Caramelos. chicles y golosinas'];;2023-01-06
74805;2.79;GRANINI néctar de naranja y mango selección botella 1 lt;GRANINI;2.79;€/l.;['Bebidas', 'Zumos'];;2023-01-06
274139;4.99;DIA NUESTRA ALACENA salchichón ibérico extra taco 380 gr;DIA NUESTRA ALACENA;13.13;€/Kg.;['Frescos', 'Charcutería y quesos', 'Curados'];;2023-01-06
289237;2.99;LA TOJA gel de ducha leche de avena bote 550 ml;LA TOJA;5.44;€/l.;['Cuidado personal', 'Baño e higiene personal', 'Geles de duchas y esponjas'];;2023-01-06
277595;3.05;KELLOGGS barrita de cereales extra choco estuche 128 gr;KELLOGGS;23.83;€/Kg.;['Despensa', 'Desayunos y dulces', 'Cereales'];;2023-01-06
180569;6.39;SCOTTEX papel higiénico megarollo paquete 9 uds;SCOTTEX;0.71;€/ud.;['Cuidado del hogar', 'Papel'];;2023-01-06
280245;6.99;SOMAT lavavajillas máquina excellence en cápsulas bolsa 18+3 uds;SOMAT;0.33;€/ud.;['Cuidado del hogar', 'Lavavajillas'];;2023-01-06
276784;5.19;SPONTEX guantes protección antivirus talla 6 caja 30 + 6 ud;SPONTEX;0.14;€/ud.;['Cuidado del hogar', 'Utensilios de limpieza'];;2023-01-06
39998;0.95;DIA paté a las finas hierbas tarro 125 gr;DIA;7.6;€/Kg.;['Despensa', 'Patés y foies'];;2023-01-06
222057;2.09;BARILLA espagueti integral caja 500 gr;BARILLA;4.18;€/Kg.;['Despensa', 'Pastas. harinas y masas', 'Pastas'];;2023-01-06
195167;2.29;PAULANER cerveza de trigo alemana botella 50 cl;PAULANER;4.58;€/l.;['Bebidas', 'Cervezas', 'Especiales'];;2023-01-06
135901;1.19;EL MOLINO DE DIA panecillos tostados con ajo y perejil bolsa 160 gr;EL MOLINO DE DIA;7.44;€/Kg.;['Despensa', 'Pan', 'Snack de pan'];;2023-01-06
152664;2.19;LA TOJA jabón de manos hidrotermal con sales minerales pack 2 x 125 gr;LA TOJA;8.76;€/Kg.;['Cuidado personal', 'Baño e higiene personal', 'Jabón'];;2023-01-06
249946;1.43;Jengibre bandeja 200 gr;;7.15;€/Kg.;['Frescos', 'Verduras y hortalizas', 'Otras verduras'];;2023-01-06
288011;3.24;SELECCIÓN DE DIA chuletas de cerdo de Sajonia bandeja (peso aprox. 350 gr);SELECCIÓN DE DIA;9.25;€/Kg.;['Frescos', 'Carne', 'Cerdo'];;2023-01-06
107047;5.99;LA GULA DEL NORTE refrigeradas bandeja 180 gr;LA GULA DEL NORTE;33.28;€/Kg.;['Frescos', 'Pescado y marisco', 'Gulas y surimi'];;2023-01-06
111887;4.89;POLIL trampa detectora de polillas de los alimentos caja 2 + 1 uds;POLIL;1.63;€/ud.;['Cuidado del hogar', 'Insecticidas'];;2023-01-06
151271;1.4;BONTE acondicionador color protect cabellos teñidos botella 300 ml;BONTE;4.67;€/l.;['Cuidado personal', 'Baño e higiene personal', 'Cuidado del cabello'];;2023-01-06
