product_id;price;product;brand;unit_price;units;categories;discount;date
231195;3.79;INSTITUTO ESPAÑOL crema corporal reparadora urea piel seca tarro 400 ml;INSTITUTO ESPAÑOL;9.48;€/l.;['Cuidado personal', 'Cuidado corporal', 'Hidratación corporal'];;2023-01-06
74720P6;9.54;ASTURIANA leche entera botella 1.5 lt PACK 6;ASTURIANA;1.06;€/l.;['Despensa', 'Lácteos y huevos', 'Leche'];;2023-01-06
186618;0.75;CABREIROA agua mineral natural botella 1 lt;CABREIROA;0.75;€/l.;['Bebidas', 'Aguas'];;2023-01-06
265826;1.85;CONDOMINIUM vino blanco frizzante 5º botella 75 cl;CONDOMINIUM;2.47;€/l.;['Bodega', 'Espumosos'];;2023-01-06
86987;3.29;BONDUELLE guisantes muy finos pack 3 x 140 gr;BONDUELLE;7.83;€/Kg.;['Despensa', 'Conservas', 'Conservas vegetales'];;2023-01-06
50001;2.35;Mango unidad (850 gr aprox.);;2.77;€/Kg.;['Frescos', 'Frutas', 'Frutas tropicales'];;2023-01-06
246138;3.29;FACKELMAN sacacorchos 1 ud;FACKELMAN;3.29;€/ud.5,49 €/ud.;['Cuidado del hogar', 'Bazar'];;2023-01-06
285528;3.89;REXONA desodorante bright bouquet spray 200 ml;REXONA;19.45;€/l.;['Cuidado personal', 'Baño e higiene personal', 'Desodorantes'];;2023-01-06
291318;2.25;FRAGATA aceitunas con hueso aliño sevillano frasco 250 gr;FRAGATA;9.0;€/Kg.;['Despensa', 'Aperitivos'];;2023-01-06
265704;12.59;DODOT Pants pañales 12-17 kg talla 5 paquete 30 uds;DODOT;0.42;€/ud.;['Bebé', 'Pañales'];;2023-01-06
33811;2.65;DIA AL PUNTO callos con chorizo lata 380 gr;DIA AL PUNTO;6.97;€/Kg.;['Despensa', 'Conservas', 'Conservas de carne'];;2023-01-06
151881;2.54;AUSONIA compresas noche super plus bolsa 9 uds;AUSONIA;0.28;€/ud.;['Cuidado personal', 'Cuidado íntimo'];;2023-01-06
84893;3.09;DANONE ACTIVIA bífidus con ciruelas 0% M.G pack 4 unidades 120 gr;DANONE ACTIVIA;6.44;€/Kg.;['Despensa', 'Lácteos y huevos', 'Yogures'];;2023-01-06
173726;1.2;BONTE esparadrapo en tejido sin tejer hipóalergenico 5m x 2.5 cm caja 1 ud;BONTE;1.2;€/ud.;['Cuidado personal', 'Botiquín'];;2023-01-06
197353;3.69;SANEX gel de ducha aceite biome protect piel normal y seca bote 550 ml;SANEX;6.71;€/l.;['Cuidado personal', 'Baño e higiene personal', 'Geles de duchas y esponjas'];;2023-01-06
284198;1.35;BETIK cañitas de papel de 4 colores bolsa 48 uds;BETIK;1.35;€/ud.;['Cuidado del hogar', 'Bazar'];;2023-01-06
284859;2.85;ECOCESTA semillas de sésamo tostado BIO bolsa 250 gr;ECOCESTA;11.4;€/Kg.;['Despensa', 'Dietéticos', 'Semillas'];;2023-01-06
268167;1.49;RED BULL bebida energética zero lata 25 cl;RED BULL;5.96;€/l.;['Bebidas', 'Bebidas isotónicas y energéticas'];;2023-01-06
151644;5.99;NIVEA Creme crema hidratante universal todo tipo de pieles lata 400 ml;NIVEA;14.98;€/l.;['Cuidado personal', 'Cuidado corporal', 'Hidratación corporal'];;2023-01-06
276692;1.49;DIA LA LLAMA servilletas blancas 1 capa paquete 200 uds;DIA LA LLAMA;1.49;€/ud.;['Cuidado del hogar', 'Papel'];;2023-01-06
150916;1.99;GALLINA BLANCA caldo de carne 100% natural envase 1 lt;GALLINA BLANCA;1.99;€/l.;['Despensa', 'Sopas', 'Caldos'];;2023-01-06
170372;3.19;ORBIT chicle grageas sabor hierbabuena bote 84 gr;ORBIT;0.05;€/ud.;['Despensa', 'Desayunos y dulces', 'Caramelos. chicles y golosinas'];;2023-01-06
947;11.99;J&B whisky botella 70 cl;J;17.13;€/l.;['Bodega', 'Alcoholes', 'Whisky'];;2023-01-06
278426;3.05;NIKE colonia ultra blue man spray 30 ml;NIKE;101.67;€/l.;['Cuidado personal', 'Baño e higiene personal', 'Colonias'];;2023-01-06
151761;7.65;EXCELLENCE tinte Negro Nº 1 caja 1 ud;EXCELLENCE;7.65;€/ud.;['Cuidado personal', 'Baño e higiene personal', 'Cuidado del cabello'];;2023-01-06
225766;5.99;NUTRÍSSE tinte Chocolate Nº 5.35 caja 1 ud;NUTRÍSSE;5.99;€/ud.;['Cuidado personal', 'Baño e higiene personal', 'Cuidado del cabello'];;2023-01-06
144409;2.95;LACASITOS bolsa 190 gr;LACASITOS;15.53;€/Kg.;['Despensa', 'Desayunos y dulces', 'Chocolates y bombones'];;2023-01-06
285913;2.95;COQUETTE colonia corporal verbena spray 200 ml;COQUETTE;14.75;€/l.;['Cuidado personal', 'Baño e higiene personal', 'Colonias'];;2023-01-06
245114;2.39;SANEX desodorante zero % extra control roll on 50 ml;SANEX;47.8;€/l.;['Cuidado personal', 'Baño e higiene personal', 'Desodorantes'];;2023-01-06
8969;2.75;DIA leche condensada desnatada bote 450 gr;DIA;6.11;€/Kg.;['Despensa', 'Lácteos y huevos', 'Leche'];;2023-01-06
282600;4.89;ELVIVE mascarilla hidra ácido hialurónico tarro 300 ml;ELVIVE;16.3;€/l.;['Cuidado personal', 'Baño e higiene personal', 'Cuidado del cabello'];;2023-01-06
187040;1.09;AMBAR cerveza especial SIN GLUTEN botella 33 cl;AMBAR;3.3;€/l.;['Bebidas', 'Cervezas', 'Especiales'];;2023-01-06
282602;3.49;ELVIVE champú hidra con ácido hialurónico bote 285 ml;ELVIVE;12.25;€/l.;['Cuidado personal', 'Baño e higiene personal', 'Champús'];;2023-01-06
232573;3.69;SANEX gel de ducha zero % anti pollution bote 550 ml;SANEX;6.71;€/l.;['Cuidado personal', 'Baño e higiene personal', 'Geles de duchas y esponjas'];;2023-01-06
82570;2.15;EL MOLINO DE DIA palmeritas de hojaldre al cacao bolsa 260 gr;EL MOLINO DE DIA;8.27;€/Kg.;['Despensa', 'Desayunos y dulces', 'Bollería'];;2023-01-06
57865;8.36;HOJIBLANCA aceite de oliva virgen extra botella 1 lt;HOJIBLANCA;8.36;€/l.;['Despensa', 'Aceites. vinagres y aliños', 'Aceites'];;2023-01-06
151912;3.19;SANEX gel de ducha dermo protector piel normal bote 250 ml;SANEX;12.76;€/l.;['Cuidado personal', 'Baño e higiene personal', 'Geles de duchas y esponjas'];;2023-01-06
273563;4.49;DIA MARI MARINERA preparado para paellas y sopas bolsa 685 gr;DIA MARI MARINERA;6.55;€/Kg.;['Congelados', 'Pescado y marisco'];;2023-01-06
271062;2.59;DIA TEMPTATION helado choco brownie con salsa de chocolate tarrina 350 gr;DIA TEMPTATION;7.4;€/Kg.;['Congelados', 'Helados'];;2023-01-06
127635;0.95;DIA TONI TONICO tónica botella 1.5 lt;DIA TONI TONICO;0.63;€/l.;['Bebidas', 'Refrescos'];;2023-01-06
261674;2.49;DIA TEMPTATION helado bombón chocolate almendrado caja 6 uds 540 gr;DIA TEMPTATION;4.94;€/Kg.;['Congelados', 'Helados'];;2023-01-06
274265;3.41;DIA NATURMUNDO dátiles Medjoul tarrina 200 gr;DIA NATURMUNDO;17.05;€/Kg.;['Despensa', 'Aperitivos'];;2023-01-06
220173;1.19;DIA GALLETECA barquillo relleno de nata paquete 240 gr;DIA GALLETECA;4.96;€/Kg.;['Despensa', 'Desayunos y dulces', 'Galletas'];;2023-01-06
275425;1.95;LOTUS galleta caramelizada paquete 250 gr;LOTUS;7.8;€/Kg.;['Despensa', 'Desayunos y dulces', 'Galletas'];;2023-01-06
6077;3.55;DIA CAFETERÍA café molido 100% Colombia paquete 250 gr;DIA CAFETERÍA;14.2;€/Kg.;['Despensa', 'Desayunos y dulces', 'Café'];;2023-01-06
287828;2.3;TOSCANELLA perlas de mozarella tarrina 125 gr;TOSCANELLA;18.4;€/Kg.;['Frescos', 'Charcutería y quesos', 'Quesos'];;2023-01-06
251128;5.99;SYOSS tinte Castaño Helado Nº 4-86 caja 1 ud;SYOSS;5.99;€/ud.;['Cuidado personal', 'Baño e higiene personal', 'Cuidado del cabello'];;2023-01-06
7389;13.49;BAILEYS licor de crema whisky original botella 70 cl;BAILEYS;19.27;€/l.;['Bodega', 'Licores', 'Cremas'];;2023-01-06
217471;5.29;TAMPAX Pearl tampón super caja 24 uds;TAMPAX;0.22;€/ud.;['Cuidado personal', 'Cuidado íntimo'];;2023-01-06
122122;1.15;DIA estropajo fibra verde paquete 4 uds;DIA;0.29;€/ud.;['Cuidado del hogar', 'Utensilios de limpieza'];;2023-01-06
233301;1.95;BONTE champú arroz y avena delicado bote 250 ml;BONTE;7.8;€/l.;['Cuidado personal', 'Baño e higiene personal', 'Champús'];;2023-01-06
200662;5.49;PATTEX limpiador de baño anti moho spray 500 ml;PATTEX;10.98;€/l.;['Cuidado del hogar', 'Productos de limpieza', 'Baño'];;2023-01-06
115196;1.82;DIA EL CENCERRO queso fresco tradicional envase  250 gr;DIA EL CENCERRO;7.28;€/Kg.;['Frescos', 'Charcutería y quesos', 'Quesos'];;2023-01-06
6314;2.25;DIA ICEBERG caramelos sabor mentol y limón bolsa 300 gr;DIA ICEBERG;7.5;€/Kg.;['Despensa', 'Desayunos y dulces', 'Caramelos. chicles y golosinas'];;2023-01-06
275122;1.15;Tomate Monterosa unidad (300 gr aprox.);;3.84;€/Kg.;['Frescos', 'Verduras y hortalizas', 'Tomates. pimientos y pepinos'];;2023-01-06
73318;4.79;VIAKAL limpiador antical botella 750 ml;VIAKAL;6.39;€/l.;['Cuidado del hogar', 'Productos de limpieza', 'Baño'];;2023-01-06
279210;1.49;EL MOLINO DE DIA mini biscotes bolsa 240 gr;EL MOLINO DE DIA;6.21;€/Kg.;['Despensa', 'Pan', 'Biscotes'];;2023-01-06
262826;1.35;DIA BÍFIDUS cremoso lima limón pack 4 unidades 125 gr;DIA BÍFIDUS;2.7;€/Kg.;['Despensa', 'Lácteos y huevos', 'Yogures'];;2023-01-06
181607;1.85;LA COSTEÑA salsa mexicana verde lata 220 gr;LA COSTEÑA;8.41;€/Kg.;['Despensa', 'Salsas', 'Mayonesa y otras salsas'];;2023-01-06
174430;1.99;HALLS caramelo sabor menta extrafuerte paquete 2 uds 64 gr;HALLS;31.09;€/Kg.;['Despensa', 'Desayunos y dulces', 'Caramelos. chicles y golosinas'];;2023-01-06
174098;1.99;DIA FIDIAS yogur al estilo griego mora y frambuesa pack 4 unidades 125 gr;DIA FIDIAS;3.98;€/Kg.;['Despensa', 'Lácteos y huevos', 'Yogures'];;2023-01-06
277497;2.45;MAYORDOMO ambientador automático encantos de Oriente recambio 250 ml;MAYORDOMO;9.8;€/l.;['Cuidado del hogar', 'Ambientadores'];;2023-01-06
231863;1.75;DIA AL PUNTO salmorejo envase 1 lt;DIA AL PUNTO;1.75;€/l.;['Platos preparados', 'Gazpachos y salmorejos'];;2023-01-06
273338;1.69;DIA VEGECAMPO aceitunas negras en rodajas pack 3 latas 50 gr;DIA VEGECAMPO;11.27;€/Kg.;['Despensa', 'Aperitivos'];;2023-01-06
37776;0.23;DIA agua mineral natural botella 50 cl;DIA;0.46;€/l.;['Bebidas', 'Aguas'];;2023-01-06
275700;2.99;SELECCIÓN DE DIA longaniza de pollo bandeja 400 gr;SELECCIÓN DE DIA;7.48;€/Kg.;['Frescos', 'Carne', 'Pollo'];;2023-01-06
116610;4.89;ELVIVE mascarilla capilar color vive tarro 300 ml;ELVIVE;16.3;€/l.;['Cuidado personal', 'Baño e higiene personal', 'Cuidado del cabello'];;2023-01-06
269741;8.31;ULTIMA alimento para gatos esterilizados anti bolas de pelo con trucha 1.5 Kg;ULTIMA;5.54;€/Kg.6,93 €/Kg.;['Mascotas', 'Gatos'];20%;2023-01-06
204980;1.99;DANONE VITALINEA yogur desnatado sabor limón pack 4 unidades 125 gr;DANONE VITALINEA;3.98;€/Kg.;['Despensa', 'Lácteos y huevos', 'Yogures'];;2023-01-06
190181;5.99;VIVE+ SALUDYVIDA jalea real para niños caja 12 viales;VIVE;0.5;€/ud.;['Despensa', 'Dietéticos', 'Complementos nutricionales'];;2023-01-06
290115;1.57;DIA IMAQE gel frío calmante para pies tubo 125 ml;DIA IMAQE;12.56;€/l.;['Cuidado personal', 'Cuidado corporal', 'Cuidado de manos y pies'];;2023-01-06
163210;2.09;SELECCIÓN DE DIA hamburguesas con ajo y perejil bandeja 360 gr;SELECCIÓN DE DIA;5.81;€/Kg.;['Frescos', 'Carne', 'Cerdo'];;2023-01-06
5543;1.49;DIA GALLETECA bizcochos con huevo paquete 400 gr;DIA GALLETECA;3.73;€/Kg.;['Despensa', 'Desayunos y dulces', 'Bollería'];;2023-01-06
160744;4.55;NATURAL HONEY loción corporal figura perfecta frasco 330 ml;NATURAL HONEY;13.79;€/l.;['Cuidado personal', 'Cuidado corporal', 'Hidratación corporal'];;2023-01-06
262447;2.35;SANEX desodorante zero % invisible roll on 50 ml;SANEX;47.0;€/l.;['Cuidado personal', 'Baño e higiene personal', 'Desodorantes'];;2023-01-06
263674;3.74;DIA EL CENCERRO queso semicurado cortado cuña 250 gr;DIA EL CENCERRO;14.96;€/Kg.;['Frescos', 'Charcutería y quesos', 'Quesos'];;2023-01-06
66337;4.99;CUCAL insecticida concentrado cucarachicida spray 400 ml;CUCAL;12.48;€/l.;['Cuidado del hogar', 'Insecticidas'];;2023-01-06
267417;2.98;DIA NATURMUNDO orejón de albaricoque tarrina 200 gr;DIA NATURMUNDO;14.9;€/Kg.;['Despensa', 'Aperitivos'];;2023-01-06
50657;5.54;CAMPO VIEJO vino tinto crianza DO Rioja botella 75 cl;CAMPO VIEJO;7.39;€/l.;['Bodega', 'Vino', 'Tinto'];;2023-01-06
290457;7.89;FAIRY lavavajillas mano concentrado ultra poder botella 1015 ml;FAIRY;7.77;€/l.;['Cuidado del hogar', 'Lavavajillas'];;2023-01-06
236340;2.19;SMINT caramelos comprimidos menta intensa sin azúcar lata 42 gr;SMINT;52.14;€/Kg.;['Despensa', 'Desayunos y dulces', 'Caramelos. chicles y golosinas'];;2023-01-06
131234;0.75;ELPOZO salchichas Frankfurt envase 140 gr;ELPOZO;5.36;€/Kg.;['Frescos', 'Charcutería y quesos', 'Cocidos'];;2023-01-06
272238;4.39;MAGNUM helado bombón doble gold caramelo caja 3 uds 213 gr;MAGNUM;20.61;€/Kg.;['Congelados', 'Helados'];;2023-01-06
54432;2.79;LINDT Excellence chocolate 70% cacao tableta 100 gr;LINDT;27.9;€/Kg.;['Despensa', 'Desayunos y dulces', 'Chocolates y bombones'];;2023-01-06
230730;2.73;BONTE tampón con aplicador silk super caja 18 uds;BONTE;0.15;€/ud.;['Cuidado personal', 'Cuidado íntimo'];;2023-01-06
228021;6.15;TASSIMO café marcilla con leche estuche 16 cápsulas;TASSIMO;0.38;€/ud.;['Despensa', 'Desayunos y dulces', 'Café'];;2023-01-06
246947;2.89;DON LUCIANO vino espumoso blue moscato botella 75 cl;DON LUCIANO;3.85;€/l.;['Bodega', 'Vino', 'Blanco'];;2023-01-06
189713;1.35;DON SIMON bebida de leche con frutas tropical zero envase 1 lt;DON SIMON;1.35;€/l.;['Bebidas', 'Zumos'];;2023-01-06
273119;3.89;SELECCIÓN DE DIA hamburguesa big New York bandeja 340 gr;SELECCIÓN DE DIA;11.44;€/Kg.;['Frescos', 'Carne', 'Vacuno'];;2023-01-06
291319;2.25;FRAGATA aceitunas con hueso aliño del abuelo frasco 250 gr;FRAGATA;9.0;€/Kg.;['Despensa', 'Aperitivos'];;2023-01-06
289795;1.59;RELEVI ambientador lavavajillas limón pack 2 x 6 ml;RELEVI;0.8;€/ud.;['Cuidado del hogar', 'Lavavajillas'];;2023-01-06
7586;2.68;Patata roja malla 2 kg;;1.34;€/Kg.;['Frescos', 'Verduras y hortalizas', 'Patatas y zanahorias'];;2023-01-06
121237;0.73;EL MOLINO DE DIA Barra de pan de picos 260 gr;EL MOLINO DE DIA;2.81;€/Kg.;['Despensa', 'Pan', 'Pan de horno'];;2023-01-06
273839;0.95;DIA IMAQE jabón de manos almendra y miel recambio 500 ml;DIA IMAQE;1.9;€/l.;['Cuidado personal', 'Baño e higiene personal', 'Jabón'];;2023-01-06
148777P6;7.2;ASTURIANA leche semidesnatada sin lactosa envase 1 lt  PACK 6;ASTURIANA;1.2;€/l.;['Despensa', 'Lácteos y huevos', 'Leche'];;2023-01-06
35488;1.05;DIA FRESHQUITOS refresco de naranja sin gas botella 1.5 lt;DIA FRESHQUITOS;0.7;€/l.;['Bebidas', 'Refrescos'];;2023-01-06
249953;3.9;IROHA Nature mascarilla facial detox carbón sachet 1 ud;IROHA;3.9;€/ud.;['Cuidado personal', 'Cuidado corporal', 'Crema facial'];;2023-01-06
129742;8.79;NATIVA leche infantil inicio 1 bote 800 gr;NATIVA;10.99;€/Kg.;['Bebé', 'Leche para bebés'];;2023-01-06
43946;1.29;DIA barritas de cereales con manzana y albaricoque estuche 150 gr;DIA;8.6;€/Kg.;['Despensa', 'Desayunos y dulces', 'Cereales'];;2023-01-06
274055;2.35;DIA NUESTRA ALACENA paleta curada reserva 50 % duroc envase 110 gr;DIA NUESTRA ALACENA;21.36;€/Kg.;['Frescos', 'Charcutería y quesos', 'Curados'];;2023-01-06
287449;1.05;JUST LOADING barrita con dátil. coco y nueces envase 40 gr;JUST LOADING;26.25;€/Kg.;['Despensa', 'Dietéticos', 'Complementos nutricionales'];;2023-01-06
263218;2.49;DIA SELECCIÓN MUNDIAL queso havarti danés en lonchas envase 240 gr;DIA SELECCIÓN MUNDIAL;12.45;€/Kg.;['Frescos', 'Charcutería y quesos', 'Quesos'];;2023-01-06
244936;2.45;BICENTURY tortitas de maíz con chocolate con leche y avellana paquete 198 gr;BICENTURY;12.37;€/Kg.;['Despensa', 'Dietéticos', 'Pérdida de peso'];;2023-01-06
55181;3.35;GULLON zero doradas al horno sin azúcar paquete 330 gr;GULLON;10.15;€/Kg.;['Despensa', 'Desayunos y dulces', 'Galletas'];;2023-01-06
263219;2.49;DIA SELECCIÓN MUNDIAL queso havarti light danés en lonchas sobre 240 gr;DIA SELECCIÓN MUNDIAL;12.45;€/Kg.;['Frescos', 'Charcutería y quesos', 'Quesos'];;2023-01-06
1155;1.04;DIA AL DIANTE espagueti integral paquete 500 gr;DIA AL DIANTE;2.08;€/Kg.;['Despensa', 'Pastas. harinas y masas', 'Pastas'];;2023-01-06
27083;14.99;COLACAO cacao soluble caja 2.5 Kg;COLACAO;6.0;€/Kg.;['Despensa', 'Desayunos y dulces', 'Cacao y cremas de cacao'];;2023-01-06
210927;2.59;SELECCIÓN DE DIA alas de pollo adobadas bandeja 450 gr;SELECCIÓN DE DIA;5.76;€/Kg.;['Frescos', 'Carne', 'Pollo'];;2023-01-06
266000;2.15;MIRANDOLI vino tinto crianza DO Utiel Requena botella 75 cl;MIRANDOLI;2.87;€/l.;['Bodega', 'Vino', 'Tinto'];;2023-01-06
282949;3.99;GARDEN GOURMET porciones veganas a base de proteína de soja bandeja 160 gr;GARDEN GOURMET;23.89;€/Kg.;['Platos preparados', 'Verduras'];;2023-01-06
271093;1.05;DIA IMAQE crema de manos con melocotón tubo 50 ml;DIA IMAQE;21.0;€/l.;['Cuidado personal', 'Cuidado corporal', 'Cuidado de manos y pies'];;2023-01-06
156598;2.39;SANYTOL toallitas desinfectantes envase 24 uds;SANYTOL;0.1;€/ud.;['Cuidado del hogar', 'Productos de limpieza', 'Hogar'];;2023-01-06
285410;1.89;DIA AL PUNTO tortilla integral bolsa 8 unidades 320 gr;DIA AL PUNTO;5.91;€/Kg.;['Despensa', 'Cocina internacional', 'Mejicana'];;2023-01-06
255620;1.49;REINA gelatina multifrutas. limón y naranja pack 6 unidades 100 gr;REINA;2.48;€/Kg.;['Despensa', 'Lácteos y huevos', 'Postres'];;2023-01-06
49018;5.82;LA MASIA aceite de oliva suave botella 1lt;LA MASIA;5.82;€/l.;['Despensa', 'Aceites. vinagres y aliños', 'Aceites'];;2023-01-06
130345;4.99;LA COCINERA croquetas artesanas de jamón ibérico bolsa 400 gr;LA COCINERA;12.48;€/Kg.;['Congelados', 'Precocinados'];;2023-01-06
158176;1.15;EL MOLINO DE DIA pan rallado con ajo y perejil bolsa 500 gr;EL MOLINO DE DIA;2.3;€/Kg.;['Despensa', 'Pan', 'Pan rallado'];;2023-01-06
144666;4.89;PANTENE Pro-v mascarilla repara y protege cabello dañado tarro 300 ml;PANTENE;16.3;€/l.;['Cuidado personal', 'Baño e higiene personal', 'Cuidado del cabello'];;2023-01-06
57862;2.79;ISABEL atún con tomate pack 3 latas 52 gr;ISABEL;17.88;€/Kg.;['Despensa', 'Conservas', 'Conservas de pescado'];;2023-01-06
130898;2.89;VILEDA estropajo salvauñas duplo 3 uds;VILEDA;0.96;€/ud.;['Cuidado del hogar', 'Utensilios de limpieza'];;2023-01-06
86666;2.0;NAVIDUL taquitos de jamón para cocinar envase 120 gr;NAVIDUL;16.67;€/Kg.;['Frescos', 'Charcutería y quesos', 'Curados'];;2023-01-06
10284;1.69;DIA GRANDIA cereales copos de arroz y trigo integral con frutos rojos paquete 300 gr;DIA GRANDIA;5.63;€/Kg.;['Despensa', 'Desayunos y dulces', 'Cereales'];;2023-01-06
207805;2.05;DIA DELICIOUS crema vinagre de modena con trufa bote 250 ml;DIA DELICIOUS;8.2;€/l.;['Despensa', 'Aceites. vinagres y aliños', 'Vinagres y aliños'];;2023-01-06
267616;2.99;GLISS champú split hair miracle cabello encrespado bote 250 ml;GLISS;11.96;€/l.;['Cuidado personal', 'Baño e higiene personal', 'Champús'];;2023-01-06
222584;1.89;PULEVA leche omega3 sin lactosa envase 1 lt;PULEVA;1.89;€/l.;['Despensa', 'Lácteos y huevos', 'Leche'];;2023-01-06
280402;3.25;TIGER KHAN fideos de arroz bolsa 375 gr;TIGER KHAN;8.67;€/Kg.;['Despensa', 'Cocina internacional', 'Oriental'];;2023-01-06
50973;1.29;DIA AL DIANTE macarrones paquete 1 Kg;DIA AL DIANTE;1.29;€/Kg.;['Despensa', 'Pastas. harinas y masas', 'Pastas'];;2023-01-06
37405;2.69;NESTLE preparado de manzana y plátano pack 4x100 gr;NESTLE;6.73;€/Kg.;['Bebé', 'Potitos y tarritos'];;2023-01-06
60671;1.59;DULCINEA fideos de colores para decorar bolsa 150 gr;DULCINEA;10.6;€/Kg.;['Despensa', 'Desayunos y dulces', 'Preparación de postres'];;2023-01-06
238064;2.79;MILKA choco brownie bolsa 150 gr;MILKA;18.6;€/Kg.;['Despensa', 'Desayunos y dulces', 'Bollería'];;2023-01-06
209537;15.99;PUERTO DE INDIAS ginebra sabor fresa botella 70 cl;PUERTO DE INDIAS;22.84;€/l.;['Bodega', 'Alcoholes', 'Ginebra'];;2023-01-06
130618;1.43;GALLO harina de trigo paquete 1 Kg;GALLO;1.43;€/Kg.;['Despensa', 'Pastas. harinas y masas', 'Harinas y levaduras'];;2023-01-06
210965;2.39;WHISKAS alimento para gatos en gelatina selección aves bolsa 4 x 100 gr;WHISKAS;5.98;€/Kg.;['Mascotas', 'Gatos'];;2023-01-06
101749;2.39;NOCILLA crema de cacao original vaso 180 gr;NOCILLA;13.28;€/Kg.;['Despensa', 'Desayunos y dulces', 'Cacao y cremas de cacao'];;2023-01-06
12008;1.75;DIA galletas relieve caja 700 gr;DIA;2.5;€/Kg.;['Despensa', 'Desayunos y dulces', 'Galletas'];;2023-01-06
206382;3.29;ORIGINAL REMEDIES champú tesoros de miel frasco 250 ml;ORIGINAL REMEDIES;13.16;€/l.;['Cuidado personal', 'Baño e higiene personal', 'Champús'];;2023-01-06
175155;2.99;LA TOJA gel de ducha + body milk bote 550 ml;LA TOJA;5.44;€/l.;['Cuidado personal', 'Baño e higiene personal', 'Geles de duchas y esponjas'];;2023-01-06
264553;4.99;DIA MARI MARINERA bacalao desmigado salado MSC envase 250 gr;DIA MARI MARINERA;19.96;€/Kg.;['Frescos', 'Pescado y marisco', 'Ahumados y salazones'];;2023-01-06
148888;5.39;DIA MARI MARINERA colas de gambón pelado crudo envase 200 gr;DIA MARI MARINERA;26.95;€/Kg.;['Congelados', 'Pescado y marisco'];;2023-01-06
266045;4.95;VIÑA TABORA vino blanco IGP de Extremadura caja 3 lt;VIÑA TABORA;1.65;€/l.;['Bodega', 'Vino', 'Blanco'];;2023-01-06
165040;4.75;DANONE DANACOL yogur líquido natural pack 6 unidades 100 g;DANONE DANACOL;7.92;€/Kg.;['Despensa', 'Lácteos y huevos', 'Yogures'];;2023-01-06
280324;2.85;LA MOLISANA tagliatelle nido nº103 paquete 500 gr;LA MOLISANA;5.7;€/Kg.;['Despensa', 'Pastas. harinas y masas', 'Pastas'];;2023-01-06
194;0.45;DIA GASEOSA cero botella 1.5 lt;DIA GASEOSA;0.3;€/l.;['Bebidas', 'Refrescos'];;2023-01-06
145849;1.09;BONTE champú familiar cabello normal botella 1 L;BONTE;1.09;€/l.;['Cuidado personal', 'Baño e higiene personal', 'Champús'];;2023-01-06
148578;1.0;REVILLA salami extra en lonchas sobre 65 gr;REVILLA;15.38;€/Kg.;['Frescos', 'Charcutería y quesos', 'Curados'];;2023-01-06
44145;2.65;DIA TEMPTATION helado sabor stracciatella barqueta 525 gr;DIA TEMPTATION;5.05;€/Kg.;['Congelados', 'Helados'];;2023-01-06
256811;3.5;BODY NATUR crema gel depilatoria hidratante tubo 200 ml;BODY NATUR;17.5;€/l.;['Cuidado personal', 'Depilación'];;2023-01-06
262439;4.75;DIA MARI MARINERA atún claro al natural pack 6 latas de 60 gr;DIA MARI MARINERA;13.19;€/Kg.;['Despensa', 'Conservas', 'Conservas de pescado'];;2023-01-06
30052;1.79;PULEVA leche omega3 envase 1 lt;PULEVA;1.79;€/l.;['Despensa', 'Lácteos y huevos', 'Leche'];;2023-01-06
207756;3.89;KELLOGGS cereales extra chocolate caja 375 gr;KELLOGGS;10.37;€/Kg.;['Despensa', 'Desayunos y dulces', 'Cereales'];;2023-01-06
244183;2.39;LITORAL fabada asturiana menos 30% sal y M.G. lata 435 gr;LITORAL;5.49;€/Kg.;['Platos preparados', 'Legumbres'];;2023-01-06
207347;1.35;AS snack para gatos rico en salmón bolsa 10 uds;AS;0.14;€/ud.;['Mascotas', 'Gatos'];;2023-01-06
285492;2.85;HERO menestra de verduras con ternera y jamón tarrito 2 x 235 gr;HERO;6.06;€/Kg.;['Bebé', 'Potitos y tarritos'];;2023-01-06
287254;3.49;NELLY cera fijadora brillo tarro 100 ml;NELLY;34.9;€/l.;['Cuidado personal', 'Baño e higiene personal', 'Cuidado del cabello'];;2023-01-06
7658;0.67;PEPSI clásica lata 33 cl;PEPSI;2.03;€/l.;['Bebidas', 'Refrescos'];;2023-01-06
20924;1.69;GULLON Diet - Fibra galletas sin azúcar estuche 240 grs;GULLON;7.04;€/Kg.;['Despensa', 'Desayunos y dulces', 'Galletas'];;2023-01-06
272020;1.29;DIA IMAQE toallitas desmaquillantes antiedad con coenzima Q10 envase 25 ud;DIA IMAQE;0.05;€/ud.;['Cuidado personal', 'Cuidado corporal', 'Limpieza facial'];;2023-01-06
207565;0.47;DIA RAMBLERS cerveza radler con zumo de limón lata 33 cl;DIA RAMBLERS;1.42;€/l.;['Bebidas', 'Cervezas', 'Con limón'];;2023-01-06
127308;1.45;EL MOLINO DE DIA  napolitana rellena de chocolate paquete 270 gr;EL MOLINO DE DIA;5.37;€/Kg.;['Despensa', 'Desayunos y dulces', 'Bollería'];;2023-01-06
134115;2.65;CABO DE HORNOS navajas al natural lata 63 gr;CABO DE HORNOS;42.06;€/Kg.;['Despensa', 'Conservas', 'Conservas de pescado'];;2023-01-06
231411;10.39;ULTIMA Nature alimento para perros mini con cordero bolsa 1.25 Kg;ULTIMA;8.31;€/Kg.;['Mascotas', 'Perros'];;2023-01-06
86108;1.75;EL MOLINO DE DIA magdalenas rellenas con cacao individuales bolsa 336 gr;EL MOLINO DE DIA;5.21;€/Kg.;['Despensa', 'Desayunos y dulces', 'Bollería'];;2023-01-06
1726;1.49;NESCAFE café descafeinado caja 10 sobres;NESCAFE;74.5;€/Kg.;['Despensa', 'Desayunos y dulces', 'Café'];;2023-01-06
228682;3.09;BONTE maquinilla de afeitar desechable 3 hojas bolsa 6 uds;BONTE;0.52;€/ud.;['Cuidado personal', 'Afeitado'];;2023-01-06
152111;1.65;CLOROMAX lejía con detergente botella 2 lt;CLOROMAX;0.83;€/l.;['Cuidado del hogar', 'Productos de limpieza', 'Hogar'];;2023-01-06
250256;2.75;BOVRIL salsa frasco 125 gr;BOVRIL;22.0;€/Kg.;['Despensa', 'Salsas', 'Mayonesa y otras salsas'];;2023-01-06
271018;4.59;SANEX aceite de ducha biome protect atopiderm nutri repair bote 550 ml;SANEX;8.35;€/l.;['Cuidado personal', 'Baño e higiene personal', 'Geles de duchas y esponjas'];;2023-01-06
275588;3.15;DIA NATURMUNDO almendras tostadas con piel sin sal bolsa 200 gr;DIA NATURMUNDO;15.75;€/Kg.;['Despensa', 'Aperitivos'];;2023-01-06
28887;9.56;Melón piel de sapo unidad (4 Kg aprox.);;2.39;€/Kg.;['Frescos', 'Frutas', 'Frutas de temporada'];;2023-01-06
46239;1.79;DIA VEGECAMPO aceitunas verdes con hueso manzanilla frasco 500 gr;DIA VEGECAMPO;3.58;€/Kg.;['Despensa', 'Aperitivos'];;2023-01-06
166182;0.99;BONTE pasta dentífrica flúor tubo 100 ml;BONTE;9.9;€/l.;['Cuidado personal', 'Cuidado bucal'];;2023-01-06
196731;2.95;YBARRA menestra de verduras frasco 400 gr;YBARRA;7.38;€/Kg.;['Despensa', 'Conservas', 'Conservas vegetales'];;2023-01-06
128657;1.65;DIA VEGECAMPO tomate frito pack 3 unidades 390 gr;DIA VEGECAMPO;1.41;€/Kg.;['Despensa', 'Salsas', 'Tomate'];;2023-01-06
142406;3.39;MAHESO porras prefritas bolsa 320 gr;MAHESO;10.59;€/Kg.;['Congelados', 'Repostería'];;2023-01-06
252314;0.99;DIA SNACK MANIAC bolitas de queso bolsa 85 gr;DIA SNACK MANIAC;11.65;€/Kg.;['Despensa', 'Aperitivos'];;2023-01-06
271369;0.65;MAHOU 5 ESTRELLAS cerveza lata 25 cl;MAHOU;2.6;€/l.;['Bebidas', 'Cervezas', 'Nacionales'];;2023-01-06
243534;4.35;CONSORCIO atún claro en aceite de oliva frasco 135 gr;CONSORCIO;32.22;€/Kg.;['Despensa', 'Conservas', 'Conservas de pescado'];;2023-01-06
122280;3.49;DIA palitos de mozzarella bolsa 400 gr;DIA;8.73;€/Kg.;['Congelados', 'Precocinados'];;2023-01-06
